title,published_at,content,url,source_name,domain,sub_domain,crawled_at
"Scientists Warn: Colorectal Cancer Is Rising Fast in Younger Adults, Reversing Decades of Progress",2026-07-04,"Scientists say expanded research, stronger prevention efforts, and wider screening are needed to help reverse these troubling cancer trends.
For much of the past century, colorectal cancer was considered a disease of older age. But that picture is changing rapidly. Nearly half of all new colorectal cancer diagnoses in the United States now occur in adults younger than 65, a dramatic increase from just over one-quarter in the mid-1990s, and the disease has become the leading cause of cancer death in adults under 50.
A new American Cancer Society (ACS) report shows that this generational shift is accelerating. While colorectal cancer rates continue to decline among older Americans, they are climbing in adults younger than 65, particularly those under 50, suggesting that the decades-long success against one of the nation’s deadliest cancers is becoming increasingly concentrated in older generations.
The trend is being driven largely by cancers arising in the distal colon, the final section of the colon, and the rectum. As a result, rectal cancer now accounts for nearly one-third of all colorectal cancer diagnoses, up from about one-quarter two decades ago. The findings were published in
CA: A Cancer Journal for Clinicians
“After decades of progress, the risk of dying from colorectal cancer is climbing in younger generations of men and women, confirming a real uptick in disease because of something we’re doing or some other exposure,” said Rebecca Siegel, senior scientific director of surveillance research at the American Cancer Society and lead author of the report. “We need to redouble research efforts to understand the cause but also circumvent deaths through earlier detection by educating clinicians and the general public about symptoms and increasing screening in people 45-54 years.”
Researchers estimate that 158,850 Americans will be diagnosed with colorectal cancer in 2026 and 55,230 will die from the disease. Although colorectal cancer remains the third most common cancer in both men and women, its burden is increasingly shifting toward younger adults, with about 200 people under age 65 diagnosed every day.
According to the ACS report, more than half of colorectal cancers are linked to risk factors that people may be able to change, including smoking, poor diet, heavy alcohol use, lack of physical activity, and excess body weight. Many cases and deaths could also be prevented through recommended screening and access to high-quality treatment.
ACS scientists found that half of the people diagnosed before age 50 are ages 45 to 49 and already qualify for screening. Even so, only 37% of people in this age group are up to date with screening, and 3 in 4 colorectal cancers in adults younger than 50 are found after the disease has already reached an advanced stage (regional or distant). When colorectal cancer is found at a local stage, the 5-year survival rate is 95%.
“These findings further underscore that colorectal cancer is worsening among younger generations and highlight the immediate need for eligible adults to begin screening at the recommended age of 45,” said Dr. William Dahut, chief scientific officer at the American Cancer Society. “The report also shines a light on the crucial importance of continued funding for research to help discover new therapies to treat the disease and advance patient care.”
“Alaska Native people persistently experience a higher incidence and mortality rates than other racial and ethnic groups for colorectal cancer, with the American Indian population a close second,” said Dr. Ahmedin Jemal, senior vice president, surveillance, prevention, and health services research at the American Cancer Society and senior author of the study. “We need to reduce these cancer disparities by investing in cancer research specific to this population and improving access to screening, to save more lives.”
Reference: “Colorectal cancer statistics, 2026” by Rebecca L. Siegel, Nikita Sandeep Wagle, Jessica Star, Tyler B. Kratzer, Robert A. Smith and Ahmedin Jemal, 2 March 2026,
CA: A Cancer Journal for Clinicians
DOI: 10.3322/caac.70067
Never miss a breakthrough:
Join the SciTechDaily newsletter.
Follow us on
American Cancer Society
Epidemiology
Public Health
Landmark Study Links Never Marrying to Significantly Higher Cancer Risk
Eating More Ultraprocessed Foods May Shorten Cancer Survivors’ Lives
Your Waistline Could Predict Cancer Better Than BMI
Colorectal Cancer Is on the Rise: Mayo Clinic Doctor Reveals 4 Keys Symptoms You Should Know
Non-Statin Cholesterol-Lowering Drug Linked to Lower Cancer Risk
New Study Reveals Disturbing Rise in Cancer Among Gen X and Millennials
4 in 10 US Cancer Cases Linked to Modifiable Risk Factors, Study Reveals
Alarming 500% Surge: Colorectal Cancer Rates Skyrocket Among U.S. Youths
Cancer Atlas: Progress in Global Cancer Fight Is Not Only Possible, but Achievable",https://scitechdaily.com/scientists-warn-colorectal-cancer-is-rising-fast-in-younger-adults-reversing-decades-of-progress/,scitechdaily,综合科技,无,2026-07-05T15:12:41+00:00
Could We Have Been Wrong About Fish Oil and Brain Health? New Study Raises Major Questions,2026-07-04,"Fish oil supplements delivered omega-3s to the brain, but a new study found that was not enough to improve cognitive health in older adults at risk for
Fish oil supplements have long been viewed as one of the simplest ways to support brain health, thanks to omega-3 fatty acids that are critical for building and maintaining brain cell membranes. But a new study suggests the biology may be far more complicated than simply getting more omega-3s into the brain.
Researchers at
Keck Medicine of
found that although high-dose fish oil supplements successfully increased omega-3 levels in the brain, they failed to improve memory, cognitive function, or brain structure in older adults at elevated risk for Alzheimer’s disease.
The findings, published June 18 in
eBioMedicine
, suggest scientists may need to better understand how the aging brain processes these nutrients rather than simply increasing their supply.
“We all wish there was a silver bullet for preventing Alzheimer’s, but our findings showed that fish oil supplements do not appear to protect brain health,” said Hussein Naji Yassine, MD, director of the USC Center for Personalized Brain Health and lead investigator of the study. “While omega-3s play an important role in forming brain cell connections needed for cognition, our results do not support fish oil supplements as a preventive measure against Alzheimer’s.”
The study included 365 adults ages 55 to 80 who rarely ate fish, a major dietary source of omega-3s, and whom the study authors considered at risk for Alzheimer’s disease. About half (47%) carried an APOE4 gene, the strongest genetic risk factor for late-onset Alzheimer’s.
Participants were randomly assigned to take either daily fish oil supplements or a placebo. The supplements contained 2,000 mg of docosahexaenoic
), an important omega-3 involved in brain function.
The first question was whether omega-3 from the supplement could actually enter the brain.
To find out, investigators measured DHA levels in cerebrospinal fluid, the fluid surrounding the brain. After six months, DHA levels in the brain rose by an average of 17%, showing that the omega-3 had reached the intended target.
The next step was to test whether that change made a measurable difference. Participants completed memory and cognitive assessments at the start of the study and again two years later. Those who took DHA supplements performed no better than those who took a placebo. Brain scans also showed that the supplements did not prevent shrinkage of the hippocampus, a memory-related brain region often used as a marker of brain aging and Alzheimer’s risk.
Yassine and his team are now trying to understand why omega-3 supplements can reach the brain without producing clear benefits for brain health. Based on earlier work, they suspect omega-3s may be more effective when consumed as part of a Mediterranean-style diet, which is naturally rich in omega-3s and has been linked with lower Alzheimer’s risk, rather than taken as a standalone supplement.
“We’re focused on better understanding how the brain processes omega-3s and whether factors, such as poor health, dietary pattern, genetic risk, and age, may change the brain’s ability to effectively absorb and use omega-3s,” said Yassine. “We are working to develop medications that may help the brain better utilize these nutrients to preserve cognitive function.”
Although the study did not test broader lifestyle habits, Yassine and his team emphasize that protecting brain health likely depends more on overall healthy living than on fish oil supplements alone.
“Staying healthy throughout life remains the most powerful tool we have for reducing Alzheimer’s risk, including regular exercise, quality sleep, and a balanced diet,” said Yassine. “Living a healthy lifestyle is the brain’s equivalent of getting regular car maintenance and high-quality oil changes. The brain is more likely to lose greater function if health issues in other parts of the body go unaddressed, in the same way that car engines stop working if regular maintenance is skipped.”
Reference: “CNS target engagement of high-dose DHA supplementation in older adults at risk for dementia: a randomised, double-blind, placebo-controlled trial” by Hussein N. Yassine, Sara Ghasem Pour, Marlene Juarez, Isabella C. Arrelanas, Nada Ali, Dante Dikeman, Ashley Sanchez, Jackson Park, Bilal Kerman, Marlon V. Duro, Isaac Asante, Stan Louie, Naoko Kono, Lina M. D’Orazio, Helena Chui, Wendy J. Mack, Michael G. Harrington, Meredith N. Braskie and Lon S. Schneider, 18 June 2026,
eBioMedicine
DOI: 10.1016/j.ebiom.2026.106316
The research was supported by the
National Institutes of Health
, grant numbers RF1AG076124, R01AG055770, R01AG067063, R01AG054434, R21AG056518, P30AG066530 and R01AG054434 and the Alzheimer’s Drug Discovery Foundation, grant number GC-201711–2014197.
Never miss a breakthrough:
Join the SciTechDaily newsletter.
Follow us on
Alzheimer's Disease
Public Health
University of Southern California
Plant-Based Diet Linked to Lower Alzheimer’s Risk, Study Finds
Eating One Egg a Day Could Cut Alzheimer’s Risk by 27%
Eating Meat Linked to Lower Dementia Risk in Key Genetic Group
Eating the Wrong Carbs May Raise Your Dementia Risk
This Special Diet May Slow Brain Aging, Harvard Study Reveals
5 Lifestyle Factors Linked to Dementia
7 Habits That Can Lower Your Risk of Dementia
New Study Shows Fructose Alters Brain Genes, Which Can Lead to Disease
New MIND Diet May Significantly Lower Risk of Alzheimer’s Disease",https://scitechdaily.com/could-we-have-been-wrong-about-fish-oil-and-brain-health-new-study-raises-major-questions/,scitechdaily,综合科技,无,2026-07-05T15:12:42+00:00
Scientists Say Intermittent Fasting Could Make Weight Loss Easier,2026-07-04,"Intermittent fasting may help some people lose weight without relying as heavily on constant food restriction.
People who repeatedly lose weight and regain it may do better with intermittent fasting than with traditional calorie counting, according to new findings.
A study from Adelaide University examined the psychological effects of intermittent fasting and calorie restriction, comparing how each approach affected eating behaviors, mood, sleep and quality of life.
Both diets produced similar weight loss, but participants following intermittent fasting did not feel they had to make major changes to their eating behaviors, such as closely watching for overeating or counting calories, to lose weight.
The calorie restriction group had a different experience. Those participants said they had to consciously focus on limiting how much they ate and avoiding overeating. That increased sense of control explained 15% of their weight loss.
“While many diets can result in weight loss, they may be difficult to stick to, and this makes keeping that weight off long-term more challenging,” said Professor Leonie Heilbronn from Adelaide University’s School of Medicine and the South Australian Health and Medical Research Institute.
“The results of our study indicate intermittent fasting could offer an alternative pathway for people who find conventional dieting challenging.”
The 18-month trial included more than 200 people with obesity. Participants were assigned to one of three groups: intermittent fasting, continuous calorie restriction or standard care.
Those in the intermittent fasting group ate 30% of their energy needs between 8 am and 12 pm on three nonconsecutive days each week, followed by a 20-hour fast. On days when they were not fasting, they could eat their usual diet.
Participants in the calorie-restricted group ate 70% of their usual diet. Those in the standard care group continued with standard diets but received healthy eating guidelines.
After six months, people in both the intermittent fasting and calorie-restricted groups had lost about seven kilograms, compared with about two kilograms in the standard diet group. Participants also reported improvements in depression and wellbeing, including on fasting days.
The findings, published in
Clinical Nutrition
, suggest that calorie restriction and intermittent fasting may support weight loss through different psychological and behavioral routes.
“Psychological and behavioral effects have a major influence on people’s abilities to adhere to diets. Intermittent fasting may help people achieve weight loss through ways that are less dependent on consciously restricting intake,” said Professor Heilbronn.
Although intermittent fasting has grown in popularity, its long-term psychological and behavioral effects are still not well understood compared with more traditional dieting methods.
“Future trials should be designed to identify individuals who struggle to improve eating behaviors, as they may do better with intermittent fasting diets, enabling more personalized weight management,” said Professor Heilbronn.
Reference: “Exploring the impact of intermittent fasting plus time-restricted eating versus calorie restriction on eating behavior, mood, sleep, quality of life in adults with obesity” by Xiao Tong Teong, Kai Liu, Andrew D. Vincent, Gary A. Wittert, Amy T. Hutchison and Leonie K. Heilbronn, 15 May 2026,
Clinical Nutrition
DOI: 10.1016/j.clnu.2026.106686
This work was supported by the National Health and Medical Research Council Project Grant (APP1143092). XTT was supported by an Australian Government Research Training Program Scholarship from The University of Adelaide.
Never miss a breakthrough:
Join the SciTechDaily newsletter.
Follow us on
Adelaide University
You Don’t Need To Lose Weight To Get Healthier, Says Harvard Study
Can Potatoes Help With Weight Loss? Scientists Reveal Surprising Benefits
Fast, Don’t Count: How the 4:3 Fasting Rhythm Beat Daily Dieting in a Yearlong Study
Avoid This Popular Snack: Scientists Reveal Simple Dietary Trick To Cut Calories
Unlocking Nutritional Success: A Clinician’s Guide to Anti-Obesity Medication Diets
Cooking Up Cravings: Researchers Uncover Why Some Foods Make Us Hungry for More
Remarkable Weight Loss – Study Finds New Benefits of a Plant-Based Diet
Vegan Diets Enhance Diet Quality and Help You Lose Weight
Researchers Find Belly Fat Is Resistant to Intermittent Fasting – “The Location Makes a Big Difference”",https://scitechdaily.com/scientists-say-intermittent-fasting-could-make-weight-loss-easier/,scitechdaily,综合科技,无,2026-07-05T15:12:44+00:00
An Underground Mystery Had Engineers Stumped Until They Followed the Rain,2026-07-04,"Engineers discovered that falling rainwater can unexpectedly reverse airflow deep underground, solving a mystery with important implications for mine safety.
Operating a facility deep underground means constantly managing two essential challenges: air and water.
Fresh air must circulate through tunnels and shafts to keep people safe, while groundwater from rainfall and underground aquifers has to be collected and pumped back to the surface. At large underground sites, including mines and research facilities, entire engineering teams are dedicated to maintaining both systems.
One such facility is the Sanford Underground Research Facility (SURF). Although mining operations no longer take place there, mining engineers remain critical to safely operating the vast network of underground tunnels and shafts.
Jason Connot, a mining engineer who has worked at SURF since 2019, oversees the facility’s ventilation system. Not long after joining the team, he and his colleagues began noticing an unusual pattern during major rainstorms.
“We noticed our fan would go haywire at 5 Shaft. Some areas would show reduced or even reversed airflow during large rain events,” Connot said.
Under normal conditions, fresh air enters SURF through two main shafts before exiting through two separate exhaust shafts. One of those, known as 5 Shaft, typically carries air out of the underground facility. During periods of heavy rainfall, however, the shaft also serves another purpose. Excess water is diverted down 5 Shaft into a deep underground pool before being pumped back to the surface later.
“At first, we didn’t know what was going on with the airflow in large rain events,” Connot said. “We could all see these airflow changes occurring throughout the underground, and we were like, why is this happening?”
Finding the answer required better measurements.
Engineers rely on data, but the team lacked enough information until Maestro airflow sensors were installed on the 2000 Level to operate an automated ventilation regulator.
Earlier clues had already begun to emerge thanks to Steve Gabriel, a Spearfish High School science teacher, and his students. They designed and installed a series of airflow monitors at SURF that captured an unusual event during a test of the shaft deluge system on the 4850 Level.
“We felt that airflow increase on the 4850 Level during that test. That’s what made the correlation and triggered everything,” Connot said.
Gabriel later joined SURF as a full-time ventilation technician.
During especially heavy rain, water entering the facility can exceed the capacity of the underground pumping system. To prevent flooding, engineers send the extra water down 5 Shaft into the deep pool, much like an overflow spillway protects an overfilled dam.
The team suspected that this rushing column of water behaved like a giant syringe, forcing air through the underground ventilation network.
It was a compelling idea, but they needed evidence.
Connot searched the scientific literature and found reports describing the same effect in large municipal sewer systems. Those studies included fluid dynamics equations that explained the phenomenon.
Working with colleagues from South Dakota Mines, the team adapted those equations to match SURF’s underground layout. The calculations closely matched the airflow changes they had observed.
“When we added our numbers and parameters to the model, everything came out spot on,” Connot said. “You would not think the weight of water droplets could move so much air.”
The findings extend beyond heavy rainstorms and could benefit underground facilities around the world.
“If there’s ever a fire, mining engineers will sometimes turn a valve on up top and just dump water down the shaft. Knowing this can change the air flow is critical information for everyone. We tested this, we’ve seen it occur,” Connot said.
Because SURF serves as a science and engineering research facility, the engineering team had the time and resources to investigate a problem that might have gone unexplored at an active mine.
“This is not the kind of study you’d always have time to do in an operational mine,” Connot noted.
Bryce Pietzyk, SURF’s director of underground operations, said that level of investigation made all the difference.
“One thing I really like about working with Jason is he really wants to dive into the kind of details needed to understand complex operations systems such as this. No one had previously taken the time to grasp this issue—but it’s absolutely critical, and that’s why the whole team supported this study,” Pietzyk said. “Thanks to this work, we’re able to be way ahead of airflow issues, predict what will happen, and configure ventilation controls in the right manner.”
Connot’s research paper, “Effects of Water Inflows on a Mine Ventilation System: A Case Study,” was published in
Mining, Metallurgy & Exploration
Dr. Andrea Brickey, Connot’s advisor and a professor in the Department of Mining Engineering and Management at South Dakota Mines, praised both the work and the curiosity behind it.
“As an advisor, one couldn’t ask for a better graduate student than Jason,” Brickey said. “He identified a phenomenon impacting ventilation systems, and his curiosity drove him to want to determine how to predict that behavior. He succeeded, and his work is helping SURF and an entire industry.”
Pietzyk also highlighted the effort required to complete the research while balancing work and family responsibilities.
“Jason is an engineer who goes above and beyond,” Pietzyk said. “The work he did to complete this research shows he really cares about this facility. He kept it all together while doing his full-time engineering job, commuting from Rapid City, completing his Master’s Degree, and raising a family. He deserves credit for this, it’s really an amazing effort.”
Reference: “Effects of Water Inflows on a Mine Ventilation System: A Case Study” by Jason Connot, Andrea Brickey, Purushotham Tukkaraja and Srivatsan Jayaraman Sridharan, 29 May 2026,
Mining, Metallurgy & Exploration
DOI: 10.1007/s42461-026-01586-0
Never miss a breakthrough:
Join the SciTechDaily newsletter.
Follow us on
Ancient Roman Gold Mines Discovered in Spain’s Pyrenees
Global Cobalt Supply Chain at Risk of Sudden, System-Wide Collapse, Study Warns
Revolutionizing Rare Earth Mining: Electrokinetic Technology Achieves 95% Recovery
Rewriting History: King Solomon’s Mines Proven Clean by Modern Science
Soap Bubbles Inspire New Software Algorithm That Makes Mining More Cost-Effective
Natural Gas Mining Could Leak Enough Methane, No Longer Considered as Clean",https://scitechdaily.com/an-underground-mystery-had-engineers-stumped-until-they-followed-the-rain/,scitechdaily,综合科技,无,2026-07-05T15:12:46+00:00
