title,published_at,content,url,source_name,domain,sub_domain,crawled_at
Alstom Rail Addresses Sustainability With Supplier Event,2026-06-20,"Alstom Rail Addresses Sustainability With Supplier Event
Prioritise Us
Rob Whyte, Managing Director UK at Alstom, believes in the power of collaboration for continued measurable business results across the rail industry
A supplier engagement event hosted by rail manufacturer
has highlighted the critical role of strategic partnerships in building resilient supply chains.
The Supplier Day and Corporate Social Responsibility
brought together more than 200 industry stakeholders, with more than 120 top British and Irish suppliers attending the celebration of collaborative procurement practices.
Rob Whyte, Managing Director UK at Alstom, says: ""We are proud that the vast majority of our spend for our UK operations is with British businesses, supporting thousands of jobs and driving economic value across the regions.
""As we look ahead, our focus is on deepening these relationships – working more strategically with our suppliers to improve competitiveness, reduce time to market and deliver greater certainty through models such as long-term agreements. Ultimately, delivering the next generation of sustainable mobility in the UK and beyond depends on a strong, innovative and aligned supply chain.
""By working together, we can unlock shared growth, create lasting social value and ensure the rail sector continues to play a vital role in supporting communities and economic development across the country.""
procurement strategy
reveals significant investment in domestic supply chains. The company allocated more than £720m ($965m) over the last year among almost 1,300 British businesses, with 33% of spending during the last 12 months directed to UK-based SMEs.
According to the company, 90% of its spending goes to British suppliers, whilst 80% of its suppliers are based in the UK, with approximately half classified as SMEs.
The ripple effects of this procurement approach extend throughout the economy. Alstom's supply chain activities support nearly 11,000 jobs across the country, whilst UK suppliers have generated around £100m ($134m) in exports to Alstom entities in 37 countries, including Australia, Brazil, Denmark, Mexico and the US.
The awards ceremony honoured nine SMEs for their contributions across multiple sustainability and social impact categories. Winners were recognised for promoting health and wellbeing, stimulating economic expansion, addressing climate change and advancing equal opportunity.
Kadel Engineering received the Fight Climate Change (SME) award for its commitment to operational carbon reduction.
Paul Rollins, Managing Director at Kadel Engineering, says: ""What a great honour for such a small company like Kadel Engineering to be recognised with an award. It was an extremely proud moment for us and lovely to feel appreciated.
""The changes we made to fight climate change may seem small but if everyone made little changes towards this goal, it would make a big difference to the future of our planet. We are proud to be an Alstom supplier and look forward to continuing our CSR journey with them.""
The full list of UK and Ireland Supplier CSR Awards 2025 winners includes Turbo Power Systems, Quest Electrical, Telent, Dellner Glass Solutions, Rullion, Olympus Global, OCS Group and HUBER+SUHNER.
The challenges facing modern procurement teams were previously outlined by Bhavik Pathak, Alstom's Director and Head of Supplier Quality for the Americas, in June
in a conversation with Supply Chain Digital
. Bhavik explains the complexity of managing globally distributed supplier networks in the rail sector.
""If I talk about our market, the rail market, our supply bases are spread globally,"" Bhavik explains. ""It's not just a matter of getting the part at the lowest price. We need to ultimately reduce the risk for the organisation.
""Let's say we have a crisis situation, how fast can we recover? Because of the geopolitical tensions and a lot going on right now in the global market, prices are fluctuating and then it comes with tariffs and all that.""
Director and Head of Supplier Quality - Americas Region
Managing Director UK at Alstom",https://supplychaindigital.com/news/alstom-rail-addresses-sustainability-with-supplier-event,Supply Chain Digital,综合媒体,关键原材料/矿产,2026-06-21T15:50:50+00:00
BESS as a ‘Swiss Army knife’ for data centers - pv magazine Global,2026-06-20,"Markets & Policy
Featured in The power puzzle – 06 – 2026
Artificial intelligence is changing how data centers consume electricity. New workloads are introducing levels of variability that conventional power systems were not designed to handle, creating operational challenges both inside the facility and across the wider grid. Battery energy storage systems (BESS) are proving an essential tool to manage these rapid demand fluctuations, as S&P Global analyst Henrique Ribeiro explains.
Henrique Ribeiro
Markets & Policy
Data Centers
Energy Storage
Batteries are set to play a central role in balancing grids in the face of rising demand from data centers. | Image: esVolta
Artificial intelligence is changing how data centers consume electricity. New workloads are introducing levels of variability that conventional power systems were not designed to handle, creating operational challenges both inside the facility and across the wider grid. Battery energy storage systems (BESS) are proving an essential tool to manage these rapid demand fluctuations, as S&P …",https://www.pv-magazine.com/2026/06/20/bess-as-a-swiss-army-knife-for-data-centers/,pv magazine,综合新能源,光伏、氢能、储能,2026-06-21T15:51:50+00:00
"2,000-Year-Old Grape Seeds Rewrite the History of Italian Wine",2026-06-20,"A genetic study of 2,000-year-old grape seeds is shedding new light on ancient winemaking.
For centuries, the vineyards of Tuscany have been associated with some of the world’s most celebrated red wines. But a cache of grape seeds buried in ancient wells is revealing a very different story about what people were growing and drinking in the region 2,000 years ago.
Dr Oya Inanli, who completed the work as part of her PhD at the
University of York
’s Department of Archaeology, said: “We sequenced the DNA of 80 seeds and found a remarkable story of continuity. A large majority of the tested seeds belonged to a single, identical variety passed directly from the Etruscans to the Romans and maintained for centuries.
“We were also able to go a step further with the genetic testing and determine the color of the ancient grapes. The markers revealed that this dominant, long-lived clone produced white berries.”
The finding was unexpected because modern Chianti is best known for red Sangiovese wines. However, white grape varieties are still grown in the region.
Professor Nancy De Grummond, from
Florida State University
, said: “Our team’s research adds an important chapter on the history of wine in the viticulture region of Chianti. What a delightful surprise to learn that the world-famous red wine of today was actually preceded by a white vintage that was curated and maintained for centuries in Etruscan and Roman times.”
After the Romans took control of the settlement, new grape varieties began appearing at Cetamura. Researchers believe these may have been preferred cultivars introduced from other parts of the growing empire.
The team also found evidence that people collected wild grapes. That conclusion came from analyzing the shape of the seeds, which can help distinguish wild grapes from cultivated varieties.
DNA analysis showed that the dominant grapevine at Cetamura was closely related to two ancient grape seeds previously identified in southern France. The connection provides biological evidence of a large agricultural network that likely helped spread and standardize grape cultivation across Roman territories.
Researchers also identified an ancient grape seed linked to a grape family that remains widespread across Central and Eastern Europe.
Its closest modern relative appears to be Baratcsuha szurke, a rare Hungarian grape variety. The genetic evidence also ties the ancient seed to a famous 400-year-old grapevine growing in Maribor, Slovenia.
The vine is officially recognized as the world’s oldest living grapevine that continues to produce fruit.
Dr. Nathan Wales of the University of York’s Department of Archaeology said: “Our new findings show that this specific grape family is ancient and resilient. It is incredible to think that the wine grapes enjoyed by the ancient Romans are mere steps away from the varieties we pour into our glasses today.
“When you drink wine made from these relic varieties, you are tasting history that is just a stone’s throw from what was served at Roman dinner tables thousands of years ago.”
Reference: “Grapevine cultivation at Cetamura del Chianti: multiproxy evidence for centuries of continuity from the Etruscans to the Romans” by Oya Inanli, Laurent Bouby, Vincent Bonhomme, Nancy de Grummond, Lara González Carretero, Roberto Bacilieri, Hannes Schroeder, Jazmín Ramos-Madrigal and Nathan Wales, 12 June 2026,
Journal of Archaeological Science
DOI: 10.1016/j.jas.2026.106605
Never miss a breakthrough:
Join the SciTechDaily newsletter.
Follow us on
University of York
Ancient DNA Unlocks 11,000 Years of Sheep and Human History
Ancient DNA Analysis Reveals Large Scale Migrations Into Bronze Age Britain
Ancient DNA Continues to Rewrite the 9,000-Year Society-Shaping History of Corn
Experimental Cultivation of Seed Crops Lost to History Reveals Much Higher Yields Than Expected
Analyzing the Current Ethical Landscape of Ancient DNA Research
Vision for Managing UK Land and Seas After Brexit Developed by Scientists
Scientists Reveal the Complex Story Behind the Beaker Phenomenon
Archaeologists Discover One of the Earliest Examples of a ‘Crayon’
DNA Sequencing Solves 4,000-Year-Old Egyptian Mummy Mystery",https://scitechdaily.com/2000-year-old-grape-seeds-rewrite-the-history-of-italian-wine/,scitechdaily,综合科技,无,2026-06-21T15:51:57+00:00
Why You Flinch When Someone Else Gets Hurt,2026-06-20,"Scientists discovered that the visual brain may secretly “feel” what it sees, turning sight into physical experience and helping make empathy possible.
Working with researchers from institutions around the world, Nicholas Hedger (University of Reading) and Tomas Knapen (Netherlands Institute for Neuroscience & Vrije Universiteit Amsterdam) investigated one of neuroscience’s biggest questions: how humans experience the world around them.
Their research uncovered a remarkable process in which the brain converts visual information into touch-related representations, helping create the rich, physical reality we experience every day. According to Knapen, “This aspect of human experience is a fantastic area for AI development.”
Imagine preparing dinner with a friend when they accidentally cut themselves. Almost instantly, you may grimace, wince, or even jerk your own hand away.
Those reactions happen because the brain’s touch-processing region, known as the somatosensory cortex, becomes active even though nothing physically happened to you.
But how can simply watching another person trigger the brain’s sense of touch?
To investigate, researchers from the UK, USA, and VU, NIN (KNAW) in Amsterdam turned to an unexpected source of data: Hollywood movies.
Tomas Knapen (last author) and Nicholas Hedger (first author) examined a dataset collected from volunteers who watched clips from movies such as
The Social Network
while undergoing brain scans.
Their goal was to identify the neural systems that transform visual information into meaningful experiences, allowing people to do more than simply see the world around them.
When neuroscientists refer to “maps” in the brain, they are describing organized patterns that represent information about the body and environment.
One well-known example is found in the somatosensory cortex, where different areas correspond to different body parts. One end of the map processes sensations from the feet, while the opposite end processes sensations from the head. These organized layouts help the brain determine where a sensation originates.
The researchers were surprised to find similar maps within the visual cortex. This suggests that the brain may organize what we see in ways that closely resemble how it processes physical touch.
“We found not one, or two, but eight remarkably similar maps in the visual cortex!” Knapen explains. “Finding so many shows how strongly the visual brain speaks the language of touch.”
These visual maps mirror the body’s arrangement within the somatosensory cortex from head to toe — suggesting that when we observe another person, the brain organizes that visual information using patterns similar to those involved in physical sensation.
The discovery of eight separate maps raises an obvious question: Why does the brain need so many?
The researchers believe different maps serve different functions. Some appear to specialize in identifying body parts, while others focus more on where those body parts are located in space.
“I think that there are many more purposes, but we just haven’t been able to test them yet,” Knapen adds.
These maps may help people extract different types of information depending on what matters most in a given moment.
“Say you stand up and grab a cup of coffee. If I’m interested in what you’re doing, I will probably focus on your hand grabbing the cup. Now imagine that I’m more interested in your emotional state. In that case, I might focus more on your overall posture or your facial expressions. Every time you look at a person, there are many different bodily translations that need to be conducted visually. We think that these maps are a fundamental ingredient in that exact process.”
Although maintaining several overlapping maps might seem inefficient, Knapen argues that it actually makes the brain more flexible.
“This allows the brain to have many types of information in a single space, and make a translation in any way that is relevant in that moment,” he explains.
The findings open the door to a wide range of future studies.
Because these body maps appear to be involved in emotional processing, they could provide new insights into social psychology and eventually contribute to clinical applications.
“People with autism can struggle with this sort of processing. Having this information could help us better identify effective treatments,” Knapen explains.
The research could also have implications for brain-computer interfaces and other forms of neurotechnology.
“Training sets for brain implants often start off with instructions like ‘try to think of a movement’. If these bodily processes can be activated in much broader ways, then there might be much broader possibilities to train and develop those brain-computer interfaces.”
Knapen believes the work may also help guide future advances in
artificial intelligence
“Our bodies are deeply intertwined with our experiences and understanding of the world. Current AI primarily relies on text and video, lacking this bodily dimension. This aspect of human experience is a fantastic area for AI development. Our work shows the potential for very large, precision brain imaging datasets to fuel this development: a beautiful synergy between neuroscience and AI.”
For Knapen, however, the biggest takeaway is not technological.
“I just want to understand the depths of the human experience, and it really feels like we just found this central ingredient for it.”
Reference: “Vicarious body maps bridge vision and touch in the human brain” by Nicholas Hedger, Thomas Naselaris, Kendrick Kay and Tomas Knapen, 26 November 2025,
DOI: 10.1038/s41586-025-09796-0
Never miss a breakthrough:
Join the SciTechDaily newsletter.
Follow us on
Artificial Intelligence
Neuroscience
AI Predicts Fruit Fly Behavior With Stunning Accuracy
Where Did That Sound Come From? MIT Neuroscientists Can Answer That Question
Meeting a 100-Year-Old Challenge Could Lead the Way to Digital Aromas
Neural Networks Tricked by Optical Illusions in the Same Way That Humans Are Deceived
Neuroscientists Study How Your Favorite Music Can Send Your Brain Into Pleasure Overload
Brain Mechanisms Underlying Irrational Decision-Making: “Happy Endings” Can Bias Future Decisions
Why Time Sometimes Flies or Drags: How the Brain Creates the Experience of Time
Is What I See, What I Imagine? Neural Overlap Discovered Between Vision and Imagination
Scientists Can See the Bias in Your Brain – Even Before You Make Your Decision",https://scitechdaily.com/why-you-flinch-when-someone-else-gets-hurt/,scitechdaily,综合科技,无,2026-06-21T15:51:59+00:00
"This Deadly Disease Was Wiping Out Humans 5,500 Years Ago",2026-06-20,"A new study suggests plague was already a deadly threat 5,500 years ago, striking small hunter-gatherer communities long before cities and agriculture emerged.
For centuries, plague has been remembered as the disease that devastated medieval Europe, killing millions and reshaping societies. But new research suggests its deadly history stretches much further back than previously thought.
A study published in
has uncovered evidence that plague was already causing fatal outbreaks 5,500 years ago among small hunter-gatherer groups in Siberia. The discovery challenges the long-held idea that plague only became a major threat after the rise of agriculture, dense settlements, and the rat-infested urban environments that later fueled historic pandemics.
An international team of researchers analyzed ancient
Yersinia pestis
, the bacterium responsible for plague.
The findings reveal that these ancient strains were far from harmless.
“Whether the earliest forms of plague were mild or virulent has been a matter of debate, but our findings demonstrate that these ancient strains were already highly lethal,” said senior author Eske Willerslev, a professor at the University of Copenhagen and the University of Cambridge.
Ancient DNA studies can reveal whether an individual carried a disease, but this project went much further. Researchers combined genetic evidence with radiocarbon dating, burial records, and family relationships preserved in DNA to reconstruct how the outbreaks unfolded within these prehistoric communities.
“Based on the plague DNA, the genetic relationships between the victims, the archaeological analysis and the radiocarbon dating, we’ve built a really clear, complete picture of what happened during these outbreaks,” said lead author Ruairidh Macleod, who conducted the research while a PhD student at the University of Cambridge and is now a research fellow at the
University of Oxford
The team detected
Yersinia pestis
DNA in 18 of the 46 individuals examined, nearly 40% of those tested. That proportion is strikingly high and exceeds rates reported from some medieval plague burial sites.
One of the strongest clues came from the cemeteries themselves.
For years, archaeologists were puzzled by an unusually large number of children and young teenagers buried at two of the sites. Unlike normal mortality patterns expected in hunter-gatherer populations, the graves appeared to reflect a sudden event that disproportionately affected younger individuals.
“The unusually high number of children and the short timespan was a real puzzle that we’ve been trying to solve since the 1990s. Finding out that plague was the cause is extraordinary, but it makes so much sense,” said archaeologist Andrzej Weber of the University of Alberta and principal investigator of the Baikal Archaeology Project.
Radiocarbon dating revealed that many of the deaths occurred within a relatively short period. In some cases, close relatives, including siblings and parents with children, appear to have died around the same time and were buried together. Such patterns are often associated with infectious disease outbreaks.
The discovery is surprising because these ancient strains lacked several genetic adaptations that later helped plague spread efficiently through fleas and rodents, the transmission route behind the infamous Black Death and other historical pandemics.
Because those traits were missing, many researchers assumed the earliest versions of plague were less dangerous.
Instead, the new study points to another possible explanation for their lethality.
The ancient strains carried a unique superantigen, a toxin-producing genetic factor absent from later plague lineages. Superantigens can trigger an overwhelming immune reaction, causing severe inflammation and potentially life-threatening complications.
“This finding changes our understanding of the earliest plague outbreaks: Even before the bacterium evolved efficient flea-borne transmission, these ancient strains appear to have carried a potent combination of virulence factors that could make infection highly lethal,” said senior author Martin Sikora, an associate professor at the University of Copenhagen.
The results suggest that some of the earliest known plague outbreaks may have been just as deadly as later historical epidemics, particularly for children, despite lacking flea-borne transmission.
The study also supports the idea that plague originated in Central or Northeast Asia before spreading across Eurasia through wild rodent populations. Archaeological evidence indicates that these hunter-gatherers had close contact with marmots, large burrowing rodents that still carry plague today. Researchers believe the disease may have passed directly from infected marmots to humans.
Reference: “Lethal plague outbreaks in Lake Baikal hunter-gatherers 5,500 years ago” by Ruairidh Macleod, Frederik V. Seersholm, Bianca De Sanctis, Angela Lieverse, Adrian Timpson, Rick Schulting, Jesper T. Stenderup, Charleen Gaunitz, Lasse Vinner, Olga Ivanovna Goriunova, Vladimir Ivanovich Bazaliiskii, Sergei V. Vasilyev, Erin Jessup, Yucheng Wang, Christopher Bronk Ramsey, Mark G. Thomas, Russell Corbett-Detig, Astrid K. N. Iversen, Andrzej W. Weber, Martin Sikora and Eske Willerslev, 17 June 2026,
DOI: 10.1038/s41586-026-10540-5
Never miss a breakthrough:
Join the SciTechDaily newsletter.
Follow us on
Anthropology
Epidemiology
University of Copenhagen
Stone Age Mystery: DNA Reveals Ancient Population Wipeout in France
What Happened to Easter Island? New Research Refutes Best-Selling Population Collapse Theory
Oldest Modern Human Genome Reconstructed Using DNA From 45,000-Year-Old Skull
Ancient Genetics Trace the Origin and Decline of the Legendary Scythians
DNA Analysis of Victims of 6,200-Year-Old Massacre Reveals Oldest Documented Site of Indiscriminate Mass Killing
Indiscriminate Killing Revealed in Genetic Analysis of Ancient Massacre
DNA Increases Our Understanding of Stone Age Cultures and Battle Axe Cultural Influences
DNA of Bones Found in Cave Reveals Major Cultural Transition in Europe Took Place Earlier Than Thought
Scientists Reveal the Complex Story Behind the Beaker Phenomenon",https://scitechdaily.com/this-deadly-disease-was-wiping-out-humans-5500-years-ago/,scitechdaily,综合科技,无,2026-06-21T15:52:01+00:00
