title,published_at,content,url,source_name,domain,sub_domain,crawled_at
Scientists Discover the First-Ever Molecules Preserved Inside a 113-Million-Year-Old Pterosaur Fossil,2026-07-04,"Ancient microbes may have helped preserve a pterosaur fossil and its chemical clues for more than 100 million years.
An international study led by Curtin University has shed new light on how a prehistoric flying reptile fossil remained exceptionally well preserved for 113 million years, offering scientists a rare view into a long-vanished world.
The fossilized wing phalanx of a pterosaur from northeastern Brazil was preserved in three dimensions and even retained chemical traces that may point to what the animal ate. Kliti Grice and her colleagues link that unusual survival to specialized bacteria and the conditions of an ancient marine environment.
Lead author Kliti Grice, a John Curtin Distinguished Professor and founding Director of the Western Australian Organic and Isotope Geochemistry Centre at Curtin, said the findings reveal a new way to understand how some fossils form.
“This fossil is a true time capsule — not only is it beautifully preserved, but for the first time we’ve detected traces of steroids in a pterosaur, providing further evidence that these creatures likely fed on fish or squid,” Professor Grice said.
“It also marks the first time molecules have been recovered from a pterosaur fossil, revealing new clues about its diet and highlighting the growing potential of molecular paleontology to unlock secrets from deep time.
“Steroid preservation in fossils is exceptionally rare, but what’s even more fascinating is that our findings challenge long-held ideas about fossil preservation itself. Rather than being destroyed by oxygen, some fossils are preserved because of it, through oxidative processes carried out by ancient microbiomes.
“After this pterosaur died and sank to the seabed, a perfect storm of chemistry, biology, and the environment worked to seal its story in stone. Microbes, including sulfur-oxidizing bacteria, began breaking down the soft tissue and fats and triggered mineralization around the body – a process that, over time, helped preserve its structure in incredible detail for more than 100 million years.”
Pterosaurs were flying reptiles that lived alongside dinosaurs and were the first
known to achieve powered flight. Some
had wingspans reaching up to 12 meters. Like birds today, they had hollow bones, a feature that can improve the chances of exceptional preservation under the right environmental conditions.
Professor Grice said the work points to a new pathway for unusual fossil preservation, while also offering fresh insight into ancient life and the environmental conditions that can protect fragile remains for immense spans of time.
It adds to the growing evidence that tiny microbes played a major role in fossil survival, a process now being identified at other fossil sites. Professor Grice said this may represent a new global Lagerstätten mechanism, meaning the special conditions that make exceptional preservation possible.
Reference: “Multi-staged mineralization and biomarker preservation in a 113-million-year-old pterosaur bone via redox shifts in diagenesis” by Kliti Grice, Stephen F. Poropat, Lorenz Schwark, Maria A. Diaz Mateus, Paul F. Greenwood, Luke M. Brosnan, Madison Tripp, Amy L. Elson, Andrew J.Y. Jian, Antônio A.F. Saraiva, Renan A.M. Bantim, Julien Demore, Alex I. Holman, Michael E. Böttcher, Adele H. Pentland, Robert H.C. Madden, Peter Hopper, Xiao Sun, Aaron Dodd, Arthur V. de Oliveira, Pieter T. Visscher, William D.A. Rickard, Juliana M. Sayão, Hossein Rahimpour-Bonab, Iris Schmiedinger, Victor O. Leshyk and Alexander W.A. Kellner, 18 June 2026,
DOI: 10.1016/j.isci.2026.116199
This research was supported by a prestigious ARC Laureate Fellowship awarded to Professor Grice.
Never miss a breakthrough:
Join the SciTechDaily newsletter.
Follow us on
Curtin University
Paleontology
Prehistoric “Vomit Fossil” Reveals Never-Before-Seen Flying Reptile
Buried for 209 Million Years, This Tiny Winged Reptile Just Changed History
Meet the Massive 100-Million-Year-Old Sky Predator That Once Ruled Australian Skies
Fearsome New Flying Predator Unveiled by 100-Million-Year-Old Bones Discovered in Queensland
152 Million Years Old – Scientists Discover the Oldest Pterodactylus Fossil Yet
Legendary Flying Reptile: Fleshing Out the Bones of Quetzalcoatlus, Earth’s Largest Flier Ever
New Insight on Pterosaur Specimen, Istiodactylus Latidens
Microraptor Feathers Were Black With Iridescent Sheen
Jurassic Period Super-Sized Fleas Had Armored Mouthparts to Attack the Thick Hide of Dinosaurs",https://scitechdaily.com/scientists-discover-the-first-ever-molecules-preserved-inside-a-113-million-year-old-pterosaur-fossil/,scitechdaily,综合科技,无,2026-07-05T15:12:47+00:00
Mystery Solved: Lost Dutch Gold Ship Identified After Nearly 400 Years,2026-07-04,"A cache of centuries-old gold coins has helped uncover the story of a lost Dutch trading ship.
For nearly 400 years, a merchant ship carrying one of the world’s most valuable commodities vanished beneath the English Channel, leaving behind little more than scattered artifacts and unanswered questions. Now, after almost three decades of archaeological and historical detective work, researchers have finally uncovered its identity, revealing a forgotten chapter of the global trade routes that connected North Africa and Europe during the Dutch Golden Age.
The wreck, discovered off England’s south coast alongside more than 400 gold coins, has been identified as the Dom van Keulen, a Dutch trading ship that departed Morocco for the Netherlands in the autumn of 1633. Far more than solving the identity of a single lost vessel, the discovery provides rare physical evidence of the lucrative gold trade that linked Morocco, West Africa, and the rapidly expanding Dutch commercial empire.
The identification is detailed in the new book
, the result of nearly 30 years of research by specialists from the British Museum, Bournemouth University (BU), and the South West Maritime Archaeology Group.
A key breakthrough came when independent historian Ian Friel uncovered records in the UK National Archives describing the ship’s final voyage. According to the documents, the vessel encountered “much tempestuous weather” while crossing toward the Netherlands, sprang a leak, and ultimately sank near Salcombe, Devon. Remarkably, although the ship and much of its valuable cargo were lost, every member of the crew survived the disaster.
Dave Parham, Professor of Maritime Archaeology at BU, edited the book with Venetia Porter, former Senior Curator for Islamic and Contemporary Middle Eastern Art at the British Museum. Porter worked with the South West Maritime Archaeology Group to learn more about the cargo and the ship after the wreck was discovered in 1995.
Dave Parham said: “Among its cargo were 150 bags of gum arabic, 64 bags of saltpeter, 320 goat skins, and 9,000 Barbary ducats, gold Moroccan coins. It is thought that most of the cargo was salvaged at the time, but more than 400 coins remained on the seabed until they were discovered by the South West Maritime Archaeology Group in 1995.”
Dave continued: “This provides important context for the wealth and architecture of the Sa‘dian Sharifs, the trade in African gold, and tangible evidence of the flourishing 17th-century maritime trade linking Morocco, the Low Countries, and Britain.”
The 400 coins, now displayed at the British Museum with other objects from the wreck, came from the Barbary Coast, now recognized as Morocco. During the 16th and 17th centuries, Dutch merchants traded manufactured goods for prized, pure West African gold. The Dutch maritime industry was large at the time, and the Netherlands had built a global trading network. Many imported foreign ducats were melted down and remade into Dutch gold coins, which became one of the world’s most widely accepted trade currencies.
Little is known about what the Dom van Keulen looked like or how large it was, and no known paintings of the ship survive. Professor Parham says the wreck site measures about 30 meters in length. It lies around 18 meters below the surface and contains cannons, anchors, and smaller cargo items.
Other objects recovered from the wreck and now owned by the British Museum include a pewter bowl and spoon, gold jewelry, a fish-shaped sounding weight, a stamp seal, pottery, and a gold finger nugget. Head of Research at the British Museum Jeremy D Hill said:
“The discovery of African gold from under the sea off the coast of Devon was an amazing discovery that raised so many questions about how it came to be there. Answering those questions has taken a team of experts, working collaboratively. The story can now be told of how a Dutch ship carrying North African gold was wrecked off the English coast, making this a discovery of international importance. It reminds us how much there is still to be found under our seas.”
The book gives a detailed account of the discovery and recovery of the wreck. It also explores the cultural history of the Sa’dian Sharifs, an Arab Sharifian dynasty that ruled Morocco when the ship’s crew would have been trading there.
The wreck is protected under the Protection of Wrecks Act 1973 and is carefully managed by Historic England. Diving at the site is limited to people who hold a license granted by the Secretary of State at DCMS. The wreck is monitored by the National Coastwatch Institution (NCI) Prawle Point station, which overlooks the area. Devon & Cornwall Police’s marine unit also carries out regular patrols nearby as part of Operation Birdie, a national effort to prevent illegal interference with historic wreck sites.
Reference: “From Morocco to the Coast of England: The Story of the Dom van Keulen and its Remarkable Cargo” by Venetia Porter and David Parham, 2026.
DOI: 10.48582/eh04-q803
Never miss a breakthrough:
Join the SciTechDaily newsletter.
Follow us on
Ancient Roman Gold Mines Discovered in Spain’s Pyrenees
Bones & DNA Tell the Story of Three African Slaves During Spanish Colonialism
Recent Human Ancestor Regularly Climbed Trees Like Apes
Dead in Unmarked Graves Identified by Combining Genetics With Genealogy
Mystery Surrounding Dinosaur Footprints on a Cave Ceiling Finally Solved
How Ancient Poop Debunked Myth of Native American Lost Civilization
Mystifying Puzzle of Early Neolithic House Orientations Finally Solved
Previously Dismissed As Myths, New Study Boosts Credibility of Columbus’ Cannibal Claims
Cave Site Reveals 78,000-Year-Old Record of Stone Age Innovation",https://scitechdaily.com/mystery-solved-lost-dutch-gold-ship-identified-after-nearly-400-years/,scitechdaily,综合科技,无,2026-07-05T15:12:49+00:00
"Alex Karp, Open Source AI and a Neocloud Heyday",2026-07-04,Subscribe to unlock,https://www.theinformation.com/newsletters/the-weekend/alex-karp-open-source-ai-neocloud-heyday,the information,综合科技,科技金融,2026-07-05T15:15:50+00:00
Pickleball Is the Past. The Tech Elite Is Obsessed With Padel,2026-07-04,Subscribe to unlock,https://www.theinformation.com/articles/pickleball-past-tech-elite-obsessed-padel,the information,综合科技,科技金融,2026-07-05T15:15:52+00:00
