title,published_at,content,url,source_name,domain,sub_domain,crawled_at
"JLR, Porsche and L'Oréal: Top Supply Chain News This Week",2026-07-04,"JLR, Porsche and L'Oréal: Top Supply Chain News This Week
Prioritise Us
This week's top supply chain news includes innovation from L'Oréal, closed-loop development from JLR and Porsche's strategy change to improve resilience
The Development of JLR's Closed-Loop Supply Chain
JLR has developed a
concept vehicle
featuring 49 more sustainable automotive components through collaboration with more than 40 supply chain partners.
According to JLR, the project has delivered more than a tonne of carbon dioxide equivalent savings, equivalent to a passenger flying from Paris to New York. The programme has also achieved multiple industry firsts.
Paul Francis, Senior Manager Circularity at JLR, says: ""What we're achieving with Cornerstone shows how JLR can lead in advancing circularity across the automotive industry, and the value of a coordinated, multi‑party approach to deliver progress faster.""
How L'Oréal is Gaining Global Recognition With Innovation
As the world's largest cosmetics company, L'Oréal has worked to drive excellence and ensure responsibility within its operations since it was founded in 1909.
Owning 36 brands and 497 patents, L'Oréal is a giant in the industry,
The company has been placed eighth in Gartner's Supply Chain Top 25.
Dow to Up Supply Chain Resilience with US$100m Investment
Dow has announced plans to invest roughly US$100m through to 2027 to expand its specialty silicones manufacturing across three countries. The investment could strengthen global supply chains for sectors including mobility, electronics and healthcare.
The company operates as the world's largest and most integrated silicones producer. Dow says the investments will expand capabilities in the US, China and Japan to meet demand growth in data centres and semiconductors.
Rethinking Porsche: Leaner, Faster and Future Proof
Porsche AG is enhancing its
supply chain
, resilience and distribution network to manage geopolitical uncertainties and international tariff policies effectively.
The sports car manufacturer is currently navigating a complex global supply environment marked by geopolitical uncertainties and shifting trade policies. In 2025, the group faced extraordinary expenses of approximately €3.9bn (US$4.4bn), which included €700m (US$797.7m) in additional costs due to US tariffs. This highlights the impact of international trade tensions on the company's financial performance.
To counter these challenges, the organisation is comprehensively repositioning itself through Strategy 2035. Dr Michael Leiters, the new CEO, is pushing for a leaner and faster company structure.
Cold Chain Federation Warns of Climate-Related Disruption
The recent heatwave over Europe and the UK has seen records broken, with extreme temperatures seeing not just individuals suffer, but also vital infrastructure feeling the pressure.
Rising temperatures and more extreme weather conditions mean that climate change is now at the forefront of supply chain leaders’ minds, as future-proofing the
resilience of supply chains
is becoming an increasing priority.
Whether it’s low water levels forcing vessels to reduce cargo loads, cooling water becoming too warm in nuclear plants leading to shutdowns or refrigerated transport, warehousing, energy costs of cooling taking a hit, a likely recurrence of extreme heat means many need to act fast to prevent future supply chain disruption.
Senior Manager, Circular Economy",https://supplychaindigital.com/news/jlr-porsche-and-loreal-top-supply-chain-news-this-week,Supply Chain Digital,综合媒体,关键原材料/矿产,2026-07-05T15:11:32+00:00
CATL is building more than 200 battery swap stations EVERY MONTH,2026-07-04,"| Jul 4 2026 - 7:40 am PT
The CATL-backed Choco-SEB battery swap network deployed its 2,000th swapping station June 30th, wrapping up another month of incredibly rapid growth that’s seen the company average more than 200 deployments in
month of 2026. (!)
As America celebrates its 250th birthday, EV battery giant CATL is reaching a major operational milestone, having deployed its 2,000th battery swap station on June 30th as it charges towards its larger, stated goal of having 3,000 stations fully up and running across the Chinese mainland and Hong Kong by the end of 2026.
CATL first announced that it had co-developed 10 new electric vehicle models with domestic automakers that use its swappable batteries last December
, as part of a bid to drive a trend that the company hopes will replace up to a third of the gas stations in China.
As of Wednesday, the company’s network of battery swap stations covered 180 cities across 31 provinces in China alone, with many more coming online quickly in Western markets as well,
thanks to CATL’s newly announced partnership with companies like Octopus Energy committed to bringing large-scale battery swapping to UK and European markets
“Battery swapping will be a significant part of the future of commercial transport,” said Dr. Robin Zeng, chairman and CEO of CATL,
in a statement
. “We have field-proven this technology in China, and we are delighted to bring it to the UK and Europe as part of our joint venture with Octopus.”
Choco-SEB’s latest expansion targeted a diverse range of urban markets, tourist spots, and commercial districts, and the company is reportedly preparing to enter new major routes like Beijing-Harbin, Beijing-Kunming, Beijing-Tibet, Daqing-Guangzhou, and Lanzhou-Haikou expressways.
If the current pace holds, CATL will have more than 4,000 battery swapping stations deployed globally by the end of 2026,
up from ~700 stations last October and ZERO
(0) at the start of 2025, proving once again that great things are possible with enough goodwill and corporate collaboration.
Here’s hoping that battery swap times that rival gas station fillups lead to even broader EV deployment somewhat sooner than later
CarNewsChina
If you’re considering going solar, it’s always a good idea to get quotes from a few installers. To make sure you find a trusted, reliable solar installer near you that offers competitive pricing, check out
, a free service that makes it easy for you to go solar. It has hundreds of pre-vetted solar installers competing for your business, ensuring you get high-quality solutions and save 20-30% compared to going it alone. Plus, it’s free to use, and you won’t get sales calls until you select an installer and share your phone number with them.
Your personalized solar quotes are easy to compare online and you’ll get access to unbiased Energy Advisors to help you every step of the way.
Get started here
Subscribe to Electrek on YouTube for exclusive videos
and subscribe to the
I’ve been involved in the electric vehicle transition in one way or another since 1997, and have covered the industry as a journalist since 2008. You can catch more of my work on Quick Charge and The Heavy Equipment Podcast.
NOTE: any opinions expressed here are solely my own and do not necessarily reflect those of the State of Illinois or its agencies. Nothing here should be interpreted as official policy, legal guidance, or an endorsement.
Find a reliable home solar and battery installer and save 20-30% compared to going it alone.
Qmerit makes electrification easy — connecting you with trusted pros who get it done right.",https://electrek.co/2026/07/04/catl-is-building-more-than-200-battery-swap-stations-every-month/,Electrek,电池,EV,2026-07-05T15:12:16+00:00
GM is flooding dealers with Bolt EVs – is that part of the plan?,2026-07-04,"| Jul 4 2026 - 6:16 am PT
GM raised plenty of eyebrows when it announced that its resurrected 2027 Chevrolet Bolt –
one of the lowest-priced, most capable new EVs in North America
– would only be built for a single model year.
Despite the limited-time offer and solid sales
, dealers are still sitting on 118 days’ of inventory, far more than the 60-day supply the industry considers healthy. That begs the question:
did GM overestimate demand, or is this all part of the plan
GM Authority
reports that Chevy sold 3,433 new Bolts during Q2 of 2026 (
up from the 791 reported by
). While that performance, on its own,
feels like enough to prove that there’s real demand for the compact electric hatchback
, it doesn’t jive with the more than 4,500 new Bolts still sitting on dealer lots, giving them more than a full fiscal quarter of inventory in a business that aims get vehicles off their floorplan in “just” 60-90 days.
Floorplanning is a bit of an industry term
, sure – but the ELI5 version is that most dealerships don’t buy the cars on their lots outright. Instead, they finance them through a bank on a revolving line of credit that’s often interest-free for the first few months, giving dealers an incentive to sell the cars before they have to start paying interest on the loan. The longer the car sits on the lot, the more it costs the dealer.
This is where it gets interesting.
Everyone seems pretty relaxed about the fact that Chevy dealers are sitting on nearly four months’ worth of 2027 Chevy Bolt inventory – and that’s including the Chevy dealers, themselves, who haven’t been especially vocal about GM continuing to build new Bolts while there are still plenty sitting on their lots.
I actually asked ChatGPT (I know) if it could find
example of Chevy dealers publicly complaining about Bolt inventory.
I couldn’t find evidence of a pattern like the one you’ve seen with Ford dealers and the Ford F-150 Lightning. In fact, the opposite seems to be true:
OPENAI CHATGPT (GPT-5.3-MINI)
Compare that to all
the pushback from Ford dealers about Model E mandates
or the high-pitched caterwauling whine of franchise
Volkswagen dealers crying about the parent company’s plans to sell Scouts direct to consumers on a fixed price model
, and you’ll see a marked difference.
That relative peace is why I think the move is deliberate, and that GM may be offering dealers some kind of floorplan assistance, additional allocation of high-demand models, or some other incentive on the back end to keep dealers happy while flooding their showrooms with months and months of Bolt inventory – and that’s totally in keeping with GM’s stated goals for its Dealer Dividends program.
“The Dealer Dividends program is an opportunity for [dealers] to earn through different tiers all the way up to the Platinum Plus level,” Kyle Birch, president of North American operations at GM Financial,
Auto Finance News
“That’s where they really start to reap the benefits [of the program] and can use those dividends however they see fit. They can put it to the bottom line, they can reduce their floorplan rate, they can use it to add incentives on vehicles.”
This is all part of the plan, in other words: GM is going to build up Bolt inventory before it shuts off the Bolt production line for good,
giving dealers new EVs to sell later while production changes over to the brand’s next generation of lithium-free plug-in cars
, all while making it easier than ever to get all the
credit they need.
That’s my take, anyway – head on down to the comments and let us know what you think about GM’s Bolt buildup, and what you think comes next.
YOU MIGHT ALSO LIKE
If you’re considering going solar, it’s always a good idea to get quotes from a few installers. To make sure you find a trusted, reliable solar installer near you that offers competitive pricing, check out
, a free service that makes it easy for you to go solar. It has hundreds of pre-vetted solar installers competing for your business, ensuring you get high-quality solutions and save 20-30% compared to going it alone. Plus, it’s free to use, and you won’t get sales calls until you select an installer and share your phone number with them.
Your personalized solar quotes are easy to compare online and you’ll get access to unbiased Energy Advisors to help you every step of the way.
Get started here
Subscribe to Electrek on YouTube for exclusive videos
and subscribe to the
I’ve been involved in the electric vehicle transition in one way or another since 1997, and have covered the industry as a journalist since 2008. You can catch more of my work on Quick Charge and The Heavy Equipment Podcast.
NOTE: any opinions expressed here are solely my own and do not necessarily reflect those of the State of Illinois or its agencies. Nothing here should be interpreted as official policy, legal guidance, or an endorsement.
Find a reliable home solar and battery installer and save 20-30% compared to going it alone.
Qmerit makes electrification easy — connecting you with trusted pros who get it done right.",https://electrek.co/2026/07/04/gm-is-flooding-dealers-with-bolt-evs-is-that-part-of-the-plan/,Electrek,电池,EV,2026-07-05T15:12:18+00:00
This Strange Martian Rock Contains a Mineral Scientists Never Expected To Find,2026-07-04,"Scientists have uncovered a previously unknown Martian rock containing a mineral never before found on the Red Planet.
Unlike Earth, where billions of years of plate tectonics, volcanism, and erosion have continually reshaped the surface,
has preserved much of its ancient geological record. That makes every rare Martian rock a valuable archive of the planet’s earliest history.
Now, an international team of scientists has uncovered one of the most intriguing examples yet: a previously unknown Martian rock type containing garnet, the first time the mineral has ever been identified in a sample from the Red Planet.
The finding could reveal new details about the temperatures, pressures, and geological processes that shaped Mars more than four billion years ago, offering scientists another piece of the puzzle of how the once-active planet evolved into the cold, arid world seen today.
The international research team included James Darling, Professor of Earth and Planetary Science at the
University of Portsmouth
’s School of the Environment and Life Sciences
Although best known as a deep-red gemstone and January’s birthstone, garnet is one of geology’s most informative minerals. Because it forms under specific combinations of heat, pressure, and chemistry, it can preserve a detailed record of the conditions in which a rock formed, making it a powerful tool for reconstructing a planet’s geological past.
Its unexpected discovery in a Martian sample provides scientists with an entirely new type of geological record from Mars, one that could reveal how parts of the planet’s crust formed and changed during its earliest history.
Professor Darling said: “The findings add a striking new dimension to our understanding of the geology of Mars and open an exciting new window into the evolution of our planetary neighbor.”
The research was led by Tanya Kizovski, Assistant Professor of Earth Sciences, from Brock University in Canada.
She said: “This discovery is going to expand our knowledge of the geologic processes that are possible on this planet. This new garnet-bearing rock type could give us clues to how Mars has changed throughout its history and new insights into the ancient environments that could have formed the garnet and related minerals.”
Kizovski and colleagues at the Royal Ontario Museum (ROM) detected the garnet while analyzing a fragment of a Martian meteorite called NWA 8171, which is held in the ROM’s collections.
Kizovski was studying the fragment’s minerals and chemical makeup.
“This little section of the meteorite looked really interesting, and the chemistry was a bit odd,” she said. “At first, we assumed it was a mineral called pyroxene, which is very common, but then we decided to take a second look.”
With the University of Portsmouth Electron Microscopy and Microanalysis Unit and the ROM’s specialized laser equipment, the group, which also includes scientists from the Università di Trieste in Italy and the Open University in the UK, unexpectedly identified garnet. Until now, that mineral had never been found on Mars.
The group studied the fragment’s chemistry and mineralogy, then considered how the garnet might have formed.
Professor Kizovski said: “Garnet is a classic example of a mineral often found in metamorphic rocks on Earth. The process of metamorphism transforms igneous or sedimentary rocks into a new form through exposure to extreme heat, high pressure, or hot fluids.
“On Mars, the heat and pressure needed to produce garnet through metamorphism could have come from the impact of a meteorite hitting the surface of Mars, magma rising up into the Martian crust, or both.”
Kizovski cautions that the evidence does not yet prove whether the garnet-bearing rock formed on Mars or arrived on the Red Planet inside another meteorite and became incorporated into its surface. That leaves open the possibility of an “extra-Martian” origin.
Scientists now need to examine the garnet’s isotopic signatures to determine whether it formed on Mars or came from another planetary body.
“Measuring oxygen isotopes from the garnet-bearing rock type itself would help to confirm if it is Martian in origin or from an exotic meteorite impactor,” Kizovski said. “Isotopes are a collection of atoms with equal numbers of protons and electrons, but different numbers of neutrons.”
That test, however, would require destroying part of the sample, “which was avoided thus far due to its rarity, as it may be the only garnet-bearing Martian rock we have for study,” she added.
ROM curator Kim Tait and Research Assistant Jessica Tomacic, together with Professor Darling, are continuing to examine the sample. “With their work and more comparisons to rover and orbital data, I’m hopeful that we will be able to learn more about the origin and history of garnet on Mars,” Kizovski said.
Reference: “Expanding Mars’ lithologic diversity: discovery of a garnet-bearing clast in NWA 8171” by T.V. Kizovski, L.F. White, A. Černok, K.T. Tait, V.E. Di Cecco, X. Chu, J.M. Tomacic, R.I. Nicklin and J.R. Darling, 16 June 2026,
Geochemical Perspectives Letters
DOI: 10.7185/geochemlet.2619
This research project is funded in part by the Government of Canada’s Natural Sciences and Engineering Research Council (NSERC) and the Killam Trusts Dorothy Killam fellowship, as well as Science and Technology Facilities Council (STFC) funding at Portsmouth.
Never miss a breakthrough:
Join the SciTechDaily newsletter.
Follow us on
Planetary Science
University of Portsmouth
Martian Slopes of Arsia Mons May Have Been Home to a Habitable Environment
Geochemical Meteorite Data Reveal How Mars Lost Its Water
Martian Meteorites Yield Clues to the Planet’s Early Atmosphere
ASU Research Shows Gusev Crater on Mars Once Held a Lake
Researchers Discover Sample of Ancient Martian Crust
Martian Meteorite Almost 4 Billion Years Younger Than Previously Thought
“Hidden Flux” of Material May Help Explain Earth’s Origins
Nakhla Fragment Shows First Evidence of Water Dissolving the Surface of Mars
“Black Beauty” – Scientists Discover a Water-Rich Martian Meteorite",https://scitechdaily.com/this-strange-martian-rock-contains-a-mineral-scientists-never-expected-to-find/,scitechdaily,综合科技,无,2026-07-05T15:12:37+00:00
James Webb Uncovers the Atmosphere of a Hellish Lava World 41 Light-Years Away,2026-07-04,"JWST data suggest 55 Cancri e may be a hydrogen-rich lava world with an atmosphere tied to its molten interior.
It is the year 2158, and you are working on a PhD in Planetary Volcanology at the University of Utopia Planitia on
. Graduate students are still paid less than they need to live on, so freeze-dried ramen has been your main food for the past three years.
After finishing your study of
’s moon Io, you now need to look beyond the solar system for a strong
comparison. Io’s volcanic activity comes from tidal heating, but your project requires a world where volcanism is driven by intense heat from its host star.
You have recently secured funding from the Exoplanet Research Institute for a faster-than-light (FTL) ship, with one requirement: the target exoplanet must be less than 50 light-years away.
In the present day, scientists have used
James Webb Space Telescope
to study 55 Cancri e (55 Cnc e), a super-Earth with a radius about 1.88 times that of Earth and a mass about 8 times larger. The planet is roughly 41 light-years away, is locked to a Sun-like star and completes an orbit in about 0.7 days.
Scientists think this extremely tight orbit may be hot enough to melt the planet’s surface. For comparison, Mercury takes 88 days to orbit our Sun. The findings were recently submitted to
Nature Astronomy
and may help scientists better understand how lava exoplanets form and change over time.
Using JWST, the scientists observed five eclipses of 55 Cnc e and compared the results with long-standing models of exoplanet formation and evolution. Those models suggest that lava planets should contain high levels of carbon monoxide (CO) and carbon dioxide (CO
The scientists concluded that the atmosphere of 55 Cnc e is likely made up of large amounts of CO, smaller amounts of CO
, and abundant hydrogen. They also noted that differences across the five eclipses could point to outgassing or to clouds produced by that outgassing. Those clouds could briefly cool the surface before fresh outgassing clears them away.
The study notes, “Since secondary atmospheres of rocky planets are set by the composition of the interior and subsequent outgassing, the composition of their atmospheres is directly linked to their interior redox states. The preference for hydrogen-rich models, together with the steep inversions they produce, therefore suggests an interior with relatively low oxygen fugacity, consistent with outgassing from a reduced magma ocean.”
For context, a planet’s redox state is the chemical balance between oxygen and hydrogen/iron within its interior. In the context of 55 Cnc e, hydrogen is heavily favored compared to oxygen, resulting in the exoplanet’s hydrogen-rich atmosphere.
Lava exoplanets have come into the spotlight in recent years, as several have been discovered within the last decade, with 55 Cnc e being discovered in 2004. These exoplanets include K2-141 b, L 98-59 d, TOI-561 b, HD 63433 d, and CoRoT-7 b, which have orbital periods of about 6.7 hours, 7.5 days, 10.5 hours, 4.2 days, and 20.4 hours, respectively. Like 55 Cnc e, all these exoplanets are tidally locked to their host stars and experience extreme temperatures. While 55 Cnc e has its lava on the sun-facing side, exoplanets like L 98-59 d have its entire surface covered in a magma ocean like Jupiter’s moon Io.
As noted in the fictionalized tale above, the volcanism on Jupiter’s moon Io is caused by tidal heating, which occurs from the small moon being stretched and compressed by Jupiter’s immense gravity. In contrast, all lava exoplanets listed above, including 55 Cnc e, are the result of the extreme temperatures they endure while orbiting at extremely close distances to their host stars. While Io has volcanism all over its surface, some lava exoplanets have their lava surfaces on the sun-facing side due to them being tidally locked.
What new insights into 55 Cnc e and other lava exoplanets will researchers make in the coming years and decades? Only time will tell, and this is why we science!
As always, keep doing science & keep looking up!
Reference: “Strong and variable stratospheric CO emission from lava-planet 55 Cnc e observed with
/JWST” by Ignas Snellen, Yamila Miguel, Leoni Janssen, Dario Gonzalez Picos, Sam de Regt, Natalie Grasser and Lars Klijn, 10 June 2026,
DOI: 10.48550/arXiv.2606.11866
Adapted from an article originally published in
UniverseToday
Never miss a breakthrough:
Join the SciTechDaily newsletter.
Follow us on
Astrophysics
James Webb Space Telescope
Planetary Science
Webb Space Telescope Reveals Rare Planet Pair That Shouldn’t Exist
This Nearby Earth-Sized Planet Could Answer Big Questions About Alien Worlds
Webb Telescope Spots “Impossible” Atmosphere Around Ancient Super-Earth
“What the Heck Is This?” – Astronomers Discover Entirely New Type of Exoplanet With Bizarre Atmosphere
James Webb Detects Strongest Evidence Yet of an Atmosphere on a Rocky Exoplanet
NASA’s Webb Just Found a Hidden Moon Factory Beyond Our Solar System
Webb Space Telescope Provides New Tools To Search for the Building Blocks of Life on Distant Planets
Webb Space Telescope: Uncovering Hidden Parts of Our Solar System
NASA’s Webb Space Telescope Primed To Reveal Secrets of Galaxy’s Most Mysterious Planets",https://scitechdaily.com/james-webb-uncovers-the-atmosphere-of-a-hellish-lava-world-41-light-years-away/,scitechdaily,综合科技,无,2026-07-05T15:12:39+00:00
