title,published_at,content,url,source_name,domain,sub_domain,crawled_at
Exploring Starbucks' Sustainable Supply Chain Initiatives,2026-07-19,"Exploring Starbucks' Sustainable Supply Chain Initiatives
Prioritise Us
Starbucks has released its 2025 Impact Report, exploring coffee sourcing standards, sustainability investments and global supply chain operations
Starbucks has spent more than five decades developing its
coffee supply chain
It has now published its 2025 Impact Report, which details how it sources coffee and manages operations across producer countries.
According to the report, Starbucks implemented its Back to Starbucks strategy at the start of the 2025 fiscal year. The approach
refocused operations
on core business activities.
Starbucks worked with Conservation International more than 20 years ago to create Coffee and Farmer Equity Practices. The programme established one of the first industry-wide sourcing standards for coffee production.
C.A.F.E. Practices provides checkpoints for farms across the supply chain. The system assesses how coffee is grown, processed and traded before it reaches Starbucks locations.
According to the 2025 Impact Report, more than 99% of the
company's coffee
came from supply chains verified to meet C.A.F.E. Practices standards in 2025. This verification process could show how the company tracks agricultural practices at origin.
The programme applies to Starbucks suppliers in multiple coffee-producing regions. Farms must meet criteria related to production methods and processing standards to qualify as C.A.F.E. Practices suppliers.
Starbucks set a distribution target in 2017 to provide 100 million coffee trees to farmers by 2025. The company has now met this target, according to the report.
Trees were donated to farmers in El Salvador, Guatemala and Mexico. The varieties were bred to withstand climate impacts and could improve productivity in these growing regions.
Kelly Goodejohn, Chief Sustainability and Social Impact Officer at Starbucks, says the company achieved several multi-year targets during the reporting period: ""For more than 50 years we've believed in the power of business to make a positive impact and our teams work every day to translate that idea into action.
""It was a year of significant progress. This includes achieving several ambitious multi-year goals, in some cases ahead of schedule.""
According to Kelly, Starbucks has invested US$200m in
coffee sustainability
to date. The company has also allocated more than US$325m to renewable energy projects and US$50m to anchor investments in two WaterEquity funds.
These investments target infrastructure that supports
supply chain
operations. Access to clean water and renewable energy could mean improved processing capacity in producer regions.
Kelly adds the company invested more than US$100m in its FoodShare hunger relief programme. This initiative operates across Starbucks locations in the US and Canada.
Starbucks College Achievement Plan completed 11 years of operation in 2025. The programme provides eligible US partners with 100% upfront tuition coverage for online bachelor's degrees at Arizona State University.
More than 28,000 partners have participated in the programme. Nearly 17,000 have graduated with degrees from ASU, according to the report.
Nearly 90% of Starbucks' US coffeehouses have at least one partner enrolled in the programme. The company also provides training and development opportunities for partners across its operations.
Starbucks has reduced its Scope 1 and 2 market-based greenhouse gas emissions by 17% since 2019. The company set a target to achieve a 50% absolute reduction in Scope 1, 2 and 3 greenhouse gas emissions by 2030, from a FY19 baseline.
According to the report, Starbucks is actively reassessing this target. The company has met 100% of electricity needs for all company-operated coffeehouses globally through power purchase agreements, renewable energy certificates and direct investments, excluding China.
Starbucks is developing new renewable energy projects and storage facilities through direct investments. Long-term contracts enable project financing for these
infrastructure additions
Starbucks launched its FoodShare programme in 2016. The initiative donates unsold food from US and Canada coffeehouses to hunger relief organisations.
According to the report, partners helped donate more than 16 million meals last year. The programme reinvested US$16.4m into hunger relief initiatives during the same period.
FoodShare has helped donate nearly 122 million meals to date. The programme has reinvested more than US$102.7m into programmes addressing food insecurity since its launch.
Kelly adds on LinkedIn that some challenges the company is addressing remain complex: ""Progress isn't always linear, and some of the challenges we're working to address are complex. But I'm encouraged by the momentum we're building and grateful to everyone who made this progress possible.""
Chief Sustainability and Social Impact Officer",https://supplychaindigital.com/news/exploring-starbucks-sustainable-supply-chain-initiatives,Supply Chain Digital,综合媒体,关键原材料/矿产,2026-07-20T15:48:41+00:00
39 Sweeteners Put to the Test Produced Surprising Gut Changes,2026-07-19,"Scientists found that sweeteners can behave unexpectedly inside a simulated gut, especially when combined with common medications.
Cambridge researchers have found that many widely used sweeteners can directly slow or alter the growth of bacteria found in the human gut. The strongest effect appeared when isosteviol, a sweetener used in foods and beverages, was combined with the antidepressant duloxetine.
In laboratory experiments, that combination sharply reduced two important bacterial
associated with digestive health and blood sugar regulation. It also produced changes that could influence inflammation and immune activity.
The researchers caution that the findings come from controlled laboratory tests, not studies involving people. More work will be needed to determine whether the same interactions occur inside the human body and whether they have meaningful health consequences.
Sweeteners are found in a wide range of everyday products, including soft drinks, candy, desserts, snacks, cereals, and some medications. They are often promoted as alternatives that provide sweetness with less sugar or fewer calories.
However, growing evidence has linked the consumption of some sweeteners with conditions including type 2 diabetes, obesity, and cancer. These associations do not necessarily prove that sweeteners directly cause those diseases, but they have raised questions about how the compounds behave inside the body.
One possible link is the gut microbiome, the enormous community of bacteria and other microorganisms living throughout the digestive tract. These microbes help break down food, produce useful compounds, support the intestinal barrier, and communicate with the immune system.
Despite the widespread use of sweeteners, relatively few studies have examined whether they interact directly with individual gut bacteria.
Professor Kiran Patil from the Medical Research Council (MRC) Toxicology Unit at the University of Cambridge said: “Most of what we know about the potential impact of sweeteners on our health comes from animal research or from population studies. While these studies have indicated involvement of the microbiome in mediating the effect of sweeteners, it’s difficult to know how sweeteners act in the body – is it through direct interactions with our gut bacteria?”
“Answering this is further complicated by the fact that we rarely ever take sweeteners by themselves – we take them with drinks, in snacks, or even in medication to mask bitterness,” added Dr. Sonja Blasche, a lead author of the study, also the MRC Toxicology Unit.
For the study, published in Molecular Systems Biology, Dr. Blasche and her colleagues investigated how artificial and low-calorie sweeteners affect gut bacteria under laboratory conditions. They also examined whether those effects changed when the sweeteners were mixed with other substances commonly consumed at the same time.
The team grew 25 bacterial species individually. The collection included microbes considered beneficial, neutral, or potentially harmful.
Each bacterial culture was then exposed to 39 commercially used sweeteners, including both natural and artificial varieties. The researchers measured whether the bacteria continued multiplying normally, grew more slowly, or stopped growing.
About three-quarters of the sweeteners altered the growth of at least one bacterial species. Some significantly slowed or completely halted the growth of microbes associated with a healthy gut.
People rarely consume sweeteners in isolation, so the scientists next combined them with other common compounds. These included caffeine, vanillin (vanilla extract), advantame (an artificial sweetener), and eight widely used medications.
The results revealed more than 100 interactions in which a sweetener affected bacteria differently when another compound was present. In 34 cases, the second substance strengthened the sweetener’s effect. In 68 cases, it weakened the effect.
This suggests that the biological impact of a sweetener may depend partly on what is eaten, drunk, or taken with it.
The most dramatic response involved isosteviol and duloxetine. Isosteviol is used in the food and beverage industry, while duloxetine is prescribed for depression and several other conditions.
Together, the two compounds strongly suppressed Roseburia intestinalis and Parabacteroides merdae. Both bacteria are associated with functions that help maintain digestive and metabolic health.
Duloxetine is also widely prescribed. In the US in 2023, more than 4.2 million patients received the medication.
Studying bacteria individually can reveal direct effects, but the gut is a crowded ecosystem in which many species constantly interact. A change affecting one organism may therefore spread through the wider microbial community.
To better approximate those conditions, the researchers built a synthetic community containing all 25 bacterial species. They allowed the community to develop and then exposed it to different combinations of sweeteners and medications.
The scientists tracked which species became more or less abundant and whether the diversity of the community changed.
The combination of isosteviol and duloxetine reduced microbial diversity in the simplified gut community. Greater microbiome diversity is generally considered a feature of a healthy and resilient digestive system, although the precise meaning of diversity can vary from person to person.
The combination also changed the balance of the community, allowing some bacterial species to thrive while others declined.
Additional experiments found that the altered microbial community became more toxic to certain host cells. It also interfered with cells involved in inflammation and immune responses.
These findings suggest that interactions between sweeteners and medications may influence more than bacterial growth alone. They could potentially affect how microbial communities communicate with the body.
Dr. Blasche said: “Sweeteners are often marketed as metabolically neutral, but our study challenges this idea. We found that they can directly affect gut bacteria, particularly when mixed with other compounds such as medication and food additives. These common combinations could have unintended effects on our gut microbiome.”
The researchers emphasize that the experiments were conducted in laboratory cultures rather than in people. The human digestive system is much more complex and includes hundreds of microbial species, changing chemical conditions, food components, and interactions with organs and immune cells.
The concentrations of sweeteners and medications reaching the gut may also differ from those used in laboratory testing. As a result, the study cannot show that consuming a particular sweetener while taking duloxetine will cause harm.
Instead, the findings identify combinations that deserve closer investigation in animals and humans.
Professor Patil, the study’s senior author, added: “Our study suggests that artificial sweeteners don’t just pass through the body passively — they can interact with gut microbes, and these effects can be amplified or altered by other substances like medications. These findings can help guide new studies towards understanding how sweeteners might influence health in unexpected ways.”
Reference: “Common xenobiotics modulate gut microbial responses to low‑calorie sweeteners in vitro” by Sonja Blasche, Vinita Periwal, Nonantzin Beristain Covarrubias, Anna Lindell, Indra Roux, Stephan Kamrad, Simone Mozzachiodi, Rob Bradley, Hilal Ozgur, Bini Ramachandran, Vladimir Benes and Kiran Raosaheb Patil, 25 June 2026,
Molecular Systems Biology
DOI: 10.1038/s44320-026-00225-6
The research was funded by the European Union’s Horizon 2020 program and the UK Medical Research Council.
Never miss a breakthrough:
Join the SciTechDaily newsletter.
Follow us on
Artificial Sweeteners
Pharmaceuticals
University of Cambridge
A Mysterious Gut Microbe Keeps Appearing in Healthy People Worldwide
Hundreds of Everyday Chemicals Found To Damage Beneficial Gut Bacteria
New Study Uncovers a Shocking Side Effect of a Parkinson’s Drug
Are New Alzheimer’s Drugs All They Promise To Be?
Common Antidepressants Cause Emotional “Blunting” – Scientists Finally Figured Out Why
Off-Patent Liver Disease Drug Could Stop COVID-19 and Protect Against Future Variants
Researchers Harness Probiotic Bacteria To Deliver Parkinson’s Disease Treatment
Warning Signs Over Effectiveness of HIV “Wonder Drug” in Sub-Saharan Africa Due to Genetic Mutations
Princeton Researchers Catalog the Gut Microbiome’s Impact on Medications",https://scitechdaily.com/39-sweeteners-put-to-the-test-produced-surprising-gut-changes/,scitechdaily,综合科技,无,2026-07-20T15:49:32+00:00
This Experimental Drug Repaired the Gut and Reversed Severe Fatty Liver Disease,2026-07-19,"An experimental drug repaired the gut and reversed severe fatty liver disease in animals, opening the door to a promising new treatment for MASH.
Researchers at Michigan Medicine have identified how an experimental drug may treat severe fatty liver disease by repairing damage in the gut, according to findings published in The Journal of Clinical Investigation.
The compound, a glycine-based tripeptide called DT-109, reversed metabolic dysfunction-associated steatohepatitis (MASH) in animal models. It worked by interrupting a harmful biological pathway that connects the intestines and liver.
MASH affects an estimated 7% of people worldwide. The disease can progress to cirrhosis, liver cancer, and liver failure, yet treatment options remain limited despite recent advances.
“We see clear evidence that DT-109 protects the gut epithelial barrier, reducing the systemic influx of harmful microbial products that are thought to contribute to MASH development and progression,” said Eugene Chen, M.D., Ph.D., senior author of the study and Frederick G. L. Huetwell Professor of Cardiovascular Medicine at the University of Michigan Medical School.
“This compound shows benefits to the gastrointestinal system and has great potential as a treatment for MASH.”
Earlier animal studies from Chen’s team had already suggested that DT-109 could be effective against MASH. The new research helps explain why the treatment appears to work.
Before evaluating the drug’s effects, the researchers confirmed an important contributor to MASH: the rapid growth of Clostridium perfringens, a bacterium that produces ammonia inside the gut.
When ammonia levels rise, they can damage the inner lining of the digestive tract and weaken the intestinal barrier. This allows toxins and other harmful microbial products to enter the bloodstream, reach the liver, and provoke inflammatory immune activity, including excessive activation of CD8+ T cells.
Through a series of experiments, the researchers found that DT-109 disrupted this damaging chain of events and helped restore the health of both the gut and liver.
The treatment reduced Clostridium perfringens levels and lowered ammonia production in the intestines of mice and nonhuman primates. These changes strengthened the intestinal barrier and limited the movement of harmful substances out of the gut.
The results in nonhuman primates were especially encouraging because their livers and gut microbiota are more similar to those of humans. In these animals, DT-109 reduced liver inflammation and eased the severity of MASH.
“DT-109 connects microbiota modulation with liver protection by restoring gut barrier integrity and limiting the systemic translocation of ammonia and other pro-inflammatory microbial products within the gut-liver axis,” said Jifeng Zhang, Ph.D., co-author and research professor of cardiovascular medicine at U-M Medical School.
“We also found that DT-109 primarily acts in the gastrointestinal tract, but its reach stretches much further.”
The findings suggest that DT-109 may eventually have uses beyond severe fatty liver disease.
Previous research has shown that the compound can reduce the development of atherosclerosis plaques and prevent vascular calcification in nonhuman primates. Those effects make it a potential candidate for treating
cardiovascular disease
Because a weakened intestinal barrier also plays a role in several digestive disorders, the researchers believe DT-109 could one day be explored as a possible treatment for conditions such as inflammatory bowel disease (IBD).
The next phase of research will involve additional testing of DT-109 with the goal of advancing it toward clinical trials. Those studies will be needed to determine whether the compound is safe and effective in humans.
“This study presents novel evidence about the pathogenesis of MASH and provides excitement about a therapeutic avenue to explore for a condition that remains difficult to treat,” said Elliot Tapper, M.D., Academic Director of Hepatology at Michigan Medicine.
“What patients with MASH need is a safe and effective therapy capable of improving their liver and heart health – of course we are excited about these developments.”
Reference: “Metabolic dysfunction–associated steatohepatitis exacerbated by
Clostridium perfringens
–derived ammonia is attenuated by tripeptide DT-109″ by Pengxiang Qu, Shusi Ding, Yanru Zhang, Yang Zhao, Erfei Song, Liangshuo Hu, Ruike Ding, Wenbin Cao, Yiting Hou, Jia Qi, Juan Zhao, Chenjing Duan, Shuangqing Liu, Chong Shen, Ying Zhao, Yanhong Guo, Zuowen Zheng, Shiwei Luo, Huizhong Hu, Liang Bai, Sihai Zhao, Bo Wang, Shuixiang He, Yi Wu, Xuelian Xiong, Qiutong Wu, Weiwang Gu, Oren Rom, Aimin Xu, Lemin Zheng, Jifeng Zhang, Enqi Liu and Y. Eugene Chen, 1 July 2026,
The Journal of Clinical Investigation
DOI: 10.1172/JCI200522
Additional authors: Yang Zhao, Ph.D., Ying Zhao M.S., Yanhong Guo, MD., Ph.D., all of University of Michigan. See remaining authors online.
Funding/disclosures: Ying Zhao, Oren Rom, Jifeng Zhang, and Y. Eugene Chen are inventors of the patent application (Tripeptides and treatment of metabolic, cardiovascular, and inflammatory disorders).
Chen is an inventor of the compound DT-109. The University of Michigan has patented it and licensed it to Diapin Therapeutics. Chen and the university have an ownership interest in Diapin. Diapin provided DT-109 for this study. The company is further developing the compound.
The study protocol involving humans, all amendments and the informed consent form were reviewed and approved by the Institutional Review Boards at each site, including the First Affiliated Hospital of Xi’an Jiaotong University (approval number: XJTU1AF2023LSK330), and the Institutional Review Board of Jinan University (approval number: 2016-017) and the University of Hong Kong/Hospital Authority Hong Kong West Cluster (approval number: UW 20–700). All experimental protocols involving non-human primates were approved by the Laboratory Animal Care Committee of Xi’an Jiaotong University (approval number: 20191278) and the Institutional Animal Care and Use Committee of Spring Biological Technology Development Co., Ltd. (approval number: 201901). The study was performed in accordance with the
National Institutes of Health
Guide for the Care and Use of Laboratory Animals.
Never miss a breakthrough:
Join the SciTechDaily newsletter.
Follow us on
University of Michigan
Millions at Risk: Popular Herbal Supplements Linked to Potential Liver Damage
New Drug Successfully Treats Fatty Liver Disease in Primate Model
Half of Parents Have Declined Kids’ Play Date Invites – Here Are Their Top Concerns
FDA Approved Drug Reverses Signs of Liver Disease in People Living With HIV
Should Doctors Accept Unvaccinated Children As Patients?
New Yale Research Reveals Insights into Alcoholic Liver Disease
Research Shows There Is a Medical Benefit to Reducing D2B Time
Hearing Restored in Noise-Deafened Mice
Asthma Drug May Lead to New Treatments for Diabetes and Obesity",https://scitechdaily.com/this-experimental-drug-repaired-the-gut-and-reversed-severe-fatty-liver-disease/,scitechdaily,综合科技,无,2026-07-20T15:49:33+00:00
