title,published_at,content,url,source_name,domain,sub_domain,crawled_at
First Close-Up Images Reveal Shackleton’s Lost Ship on the Ocean Floor,2026-07-19,"More than a century after Ernest Shackleton last walked its deck, his final ship has emerged from the darkness at the bottom of the Labrador Sea.
The first close-up images of
reveal a vessel that is damaged but still unmistakable. Its bow, deck, and several portholes remain visible beneath pink corals, while cod, redfish, wolffish, and other marine life now move through the wreck.
A joint expedition led by the Royal Canadian Geographical Society and Woods Hole Oceanographic Institution captured the images using WHOI’s Falcon remotely operated vehicle and the human-occupied submersible
. The celebrated deep-sea vehicle also carried the first people to the wreck of the
40 years ago.
John Geiger, the expedition leader and CEO of the Royal Canadian Geographical Society, joined
first dive to
and described the encounter as a “moving experience.”
“To see Shackleton’s ship, and to think that Shackleton was standing on that deck a century ago. At first, there was a lot of darkness, but suddenly the bow emerges as you are going towards it. It’s incredible,” said Geiger.
was discovered in 2024, resting upright about 390 meters (1,280 feet) below the surface. That expedition could only produce side-scan sonar images, leaving the ship visible as an outline rather than a detailed wreck.
The latest mission allowed researchers to examine it directly for the first time. They found the main mast lying down and significant damage across the ship. Large fishing nets also covered parts of the wreck, blocking the team’s view and raising concerns about the lasting effects of commercial activity on the ocean floor.
“There is a lot of damage to the ship,” said Geiger. “The nets are a sad story, limiting our ability to look at the wreck. I think we have to take responsibility for what we are doing to our oceans; that’s a huge issue.”
Despite that damage,
has become a thriving artificial reef. Corals cling to its wooden remains, and fish shelter around a ship once built to survive some of the world’s most hostile seas.
Chief Mission Specialist Mark Pathy, who helped locate the wreck with Geiger in 2024, returned to see it at close range. He hopes the expedition will encourage a new generation to explore the planet with the same curiosity associated with Shackleton and fellow polar explorer Robert Falcon Scott.
“I hope it inspires people to explore the planet and to understand that there are undiscovered wonders to see and experience out there. It really is a magical place, our planet,” said Pathy.
occupies a unique place in exploration history because it became the setting for the final chapter of Shackleton’s life.
Shackleton is best remembered for the Endurance expedition, one of history’s most extraordinary survival stories. After
became trapped and destroyed by ice in the Weddell Sea, he led every member of his crew to safety through nearly two years of isolation, dangerous sea crossings, and brutal Antarctic conditions.
He returned to the southern polar regions aboard
in 1921. Shackleton died on the ship in 1922 at age 47 while it was anchored at South Georgia, before the expedition could fully begin.
story continued for another four decades. The vessel later returned to Arctic work, served during World War II, and resumed sealing after the war. On May 5, 1962, ice floes crushed its hull near Labrador, sending it to the seabed. The crew escaped safely.
The current expedition took years to organize and brought together specialists in deep-sea operations, marine archaeology, mapping, and underwater imaging. Among them was
pilot Bruce Strickrott.
“Exploring any wreck with a human-occupied submersible is a complicated task,” said Strickrott. “Our success today and the coming days is a direct result of having a group of deep-submergence professionals with extensive experience operating in extremely complicated surroundings.”
Over three days, the team surveyed and mapped
using Canadian-made underwater photogrammetry equipment from Voyis. Thousands of overlapping images will be combined to produce a highly detailed digital twin of the wreck.
The model will preserve the ship’s present condition even as currents, fishing equipment, marine organisms, and the slow deterioration of its wooden structure continue to alter the site. It will also allow researchers and the public to explore
virtually without disturbing the wreck.
“In addition to using Alvin to put the first human eyes on Quest in more than 60 years, we’ll be using the very best imaging technology available to create a digital twin of the ship,” said Dwight Coleman, Co-Chief Scientist from WHOI for the expedition. “This type of 3D modeling has only existed in ocean science for the last couple of years, and it’s giving us entirely new ways to explore these historic wrecks and make them real for the public.”
The expedition will next travel northeast toward Greenland to survey
, another vessel closely linked to the Heroic Age of Antarctic exploration.
carried Robert Falcon Scott on his final Antarctic expedition. Scott reached the South Pole in 1912, only to discover that a Norwegian team led by Roald Amundsen had arrived five weeks earlier. Scott and four companions died during the return journey.
later worked as a sealing vessel in Canadian waters before sinking. Shackleton had originally planned to take
into the Canadian Arctic before redirecting his final expedition toward Antarctica. The two wrecks now offer researchers a rare opportunity to document the final ships associated with two of the most famous and tragic figures in polar exploration.
are owned by the U.S. Navy and operated by WHOI with support from the U.S. National Science Foundation (NSF). The mission’s remotely operated vehicle is provided through the NSF-supported Ocean Observatories Initiative (OOI) at WHOI.
Never miss a breakthrough:
Join the SciTechDaily newsletter.
Follow us on
Oceanography
Woods Hole Oceanographic Institution
Lost for a Century: First-Ever Images Reveal Sunken WWI Submarine’s Final Resting Place
Forbidden Secrets of Ancient Japanese Tombs Revealed Thanks to Satellite Images
Archaeologists Discover Almost 500 Ancient Ceremonial Sites in Southern Mexico
A Recent Reversal Discovered in the Response of Greenland’s Ice Caps to Climate Change
Microbial Predators at Hydrothermal Vents Play Important Role in Deep-Sea Carbon Cycling
$500 Billion: The Staggering Potential Value of Studying the Ocean’s Biological Carbon Pump
Southeast Asia Megadrought: Previously Unknown Mid-Holocene Event Led to Major Changes in Human Settlement
A Rapidly Changing Arctic: Significantly More Carbon & Nutrients to North Pole
Efficiency of the Ocean’s “Biological Carbon Pump” Has Been Drastically Underestimated",https://scitechdaily.com/first-close-up-images-reveal-shackletons-lost-ship-on-the-ocean-floor/,scitechdaily,综合科技,无,2026-07-20T15:49:42+00:00
Stanford Scientists Solve a 252-Million-Year-Old Mass Extinction Mystery,2026-07-19,"Clams and snails rule today’s shores because their ancient ancestors survived a catastrophe that erased nearly all ocean life.
The shells scattered along modern beaches are clues to an ancient catastrophe. Clams and snails are common today partly because their distant relatives survived the worst mass extinction in Earth’s history, while many of their former rivals nearly vanished.
Stanford-led
study helps explain why.
About 252 million years ago, the Permian-Triassic extinction event eliminated 96% of marine
and 70% of land animals. Known as the “Great Dying,” it was far more destructive than the later disaster that wiped out the non-avian dinosaurs.
Yet the crisis was not equally deadly for every branch of animal life. Some groups that had dominated the oceans for hundreds of millions of years suffered catastrophic losses, while others endured and eventually took their place.
Brachiopods were among the biggest casualties. These shelled animals resemble clams but belong to a completely different evolutionary group. Before the extinction, they were among the most abundant creatures on the seafloor. Crinoids, or sea lilies, and several other mostly stationary bottom dwellers also declined sharply.
Mollusks fared considerably better. Only about half of species, such as clams and snails, disappeared. Their survival helped set the stage for the oceans we recognize today, where mollusks, fish, starfish, and sea urchins are far more prominent than brachiopods.
“With this study, we essentially wanted to solve the mystery of why, when you go to the beach, you collect the shells of clams and snails rather than those of brachiopods,” said lead study author Jose Andres Marquez, a former PhD student in the lab of Erik Anders Sperling at Stanford. “Our findings show that, across different organism groups, extinctions happened at much higher rates for those more vulnerable to increases in water temperature and decreases in oxygen availability.”
The environmental crisis began with an extraordinary period of volcanic activity. Vast eruptions released carbon dioxide, methane, and other gases that heated the planet and disrupted the chemistry of the oceans.
Warm water naturally holds less dissolved oxygen than cool water. At the same time, heat accelerates the chemical reactions inside an animal’s body, increasing the amount of oxygen it needs. Marine organisms therefore faced a dangerous double pressure: oxygen supplies were shrinking just as their bodies demanded more.
“This study is really the final nail in the coffin for what caused the Permian-Triassic mass extinction,” said Sperling, the study’s senior author and an associate professor of Earth and planetary sciences in the Stanford Doerr School of Sustainability. “The biggest mass extinction of all time started from a world that is very similar to today in having a relatively cool, relatively well-oxygenated ocean, and then there was a giant injection of carbon dioxide into the Earth system. Understanding how Earth and Earth’s biota responded back then could inform us of what’s to come.”
To understand why certain animals were more vulnerable, the researchers looked beyond fossils and examined how living representatives of ancient marine groups respond to heat and low oxygen.
Metabolism includes the chemical processes an organism uses to produce energy and stay alive. During the Paleozoic period, which ended with the Great Dying, many common ocean animals had slow metabolisms. They lived on the seafloor, moved little or not at all, and collected food by filtering particles from the surrounding water.
Brachiopods, crinoids (sea lilies, related to starfish), and certain corals and sea anemones fit this general pattern. Their low-energy lifestyles worked well under stable conditions, but the new experiments suggest that they became a serious disadvantage as the oceans warmed.
The animals that became dominant after the extinction tended to be more mobile, muscular, and metabolically active. Fish are the clearest example, but the shift also favored snails, sea urchins, and bivalves, such as clams, oysters, and mussels.
Bivalves often have heavier bodies and a muscular “foot” that allows them to crawl, dig, or anchor themselves. Supporting that extra tissue requires more energy than the relatively simple bodies of brachiopods.
“This is why we eat clam chowder and we don’t eat brachiopod chowder,” Sperling said. “Brachiopods have almost no meat.”
That difference may seem unfavorable because active animals require more oxygen even under ordinary conditions. However, the researchers found that their bodies were also better prepared to increase oxygen intake when temperatures rose.
The team collected animals representing both Paleozoic and modern marine communities, including brachiopods from Washington state’s San Juan Islands. At field stations and in Sperling’s Stanford laboratory, the researchers placed the animals in chambers and measured how much oxygen they consumed as water temperatures changed.
The experiments revealed an unexpected tradeoff. Brachiopods and other slow-metabolism animals could survive in low-oxygen water that would suffocate many modern marine species. But their advantage disappeared as the water became warmer.
As temperatures increased, their oxygen requirements rose much more sharply. Their slow metabolisms, limited muscles, and respiratory structures could not deliver enough oxygen to keep pace.
Modern animals began with higher oxygen needs, but their more powerful muscles and gills gave them greater capacity to respond when warming pushed those needs even higher.
In other words, the Paleozoic animals were highly efficient under cool, stable conditions but had little room to adjust when their environment changed. The more active animals consumed more energy, yet they also possessed the biological equipment needed to survive a rapidly warming ocean.
“Warming and oxygen loss are the key drivers,” said Sperling.
The work builds on a
However, the physiological measurements available at the time came mostly from modern fish and crustaceans. Those commercially important animals were poorly suited to represent brachiopods, crinoids, and other groups that suffered the most devastating losses.
“In our new study, we filled in this gap about the physiology of the Paleozoic fauna to see if we could explain not only the biogeography of the extinction but the taxonomic selectivity of the extinction,” said Sperling.
The results provide a biological explanation for one of the largest turnovers in the history of animal life.
Before the Great Dying, brachiopods outnumbered bivalves. Today, only about 400 brachiopod species remain, while an estimated 10,000-15,000 bivalve species inhabit marine and freshwater environments.
Sperling compared the transformation to the extinction of the non-avian dinosaurs 65 million years ago, “where mammals essentially took over and never gave up that niche to reptiles again.”
The Great Dying did something similar in the oceans. It removed many of the animals that had defined Paleozoic seafloors and opened ecological space for mollusks and other survivors. Fossil evidence indicates that this shift from brachiopod-dominated communities toward mollusk-dominated ones occurred around the Permian-Triassic boundary and helped shape modern marine ecosystems.
Ocean acidification may also have intensified the crisis. Carbon dioxide entering seawater changes its chemistry and makes it harder for some animals to build and maintain shells. The researchers concluded that acidification probably contributed to the extinction, but it was not nearly as destructive as the combined effects of heat and oxygen loss.
The Stanford team now plans to test additional marine groups and investigate how warming, declining oxygen, and acidification interact. All three pressures are increasing in parts of the modern ocean.
The comparison with the present is not exact. The Great Dying unfolded over thousands of years and involved volcanic activity on a scale unlike anything occurring today. Still, the underlying biological problem is familiar: warming water carries less oxygen while forcing animals to use more of it.
“The bad news is, we are on track for Permian-Triassic levels of warming in worst-case scenario projections,” said Sperling.
Temperatures rose by 8-12°
) during the Great Dying. That increase occurred over thousands of years. Modern projections indicate that temperatures could climb 1.5-4° Celsius (2.7-7.2° Fahrenheit) above pre-industrial levels by 2100, compressing a major environmental change into only 100-200 years.
“The good news is, we’re still at the point where we can change things and do something about it.”
Reference: “Differences in physiological tolerance to global warming caused the Permian–Triassic transition between the Paleozoic and Modern faunas” by J. Andres Marquez, Justin L. Penn, Richard G. Stockey, Thomas H. Boag, Murray I. Duncan, Kyra N. McClure, Kendall Matsumoto, Kemi F. Ashing-Giwa, Christopher P. Noll, Curtis Deutsch, Jonathan L. Payne and Erik A. Sperling, 6 July 2026,
Proceedings of the National Academy of Sciences
DOI: 10.1073/pnas.2533086123
Funding was provided by the U.S. National Science Foundation,
, the Palaeontological Association, and the Stanford Woods Institute for the Environment.
Never miss a breakthrough:
Join the SciTechDaily newsletter.
Follow us on
Global Warming
Oceanography
Paleontology
Stanford University
Stanford Scientists Solve the Mystery of Antarctica’s Cooling Waters
Stanford Scientists Crack 252-Million-Year-Old Biodiversity Mystery
‘A Really Bad Time to Be Alive’ – Ocean Deoxygenation Linked to Ancient Die-Off
Global Warming, Ocean Acidification: Earth Was Stressed Before Dinosaur Extinction
Earth Recovered 10 Million Years After Permian-Triassic Mass Extinction
Support for Climate Change Policies Dwindling
Southern Ocean Research Shows Decrease in Dense Antarctic Bottom Water
Changes in Ocean Salinity and the Water Cycle Could Affect Food Supplies
New Research Shows Southern Ocean as a Powerful Influence on Climate Change",https://scitechdaily.com/stanford-scientists-solve-a-252-million-year-old-mass-extinction-mystery/,scitechdaily,综合科技,无,2026-07-20T15:49:44+00:00
"Alphabet, SpaceX Spur Record U.S. Equity Sales",2026-07-19,Subscribe to unlock,https://www.theinformation.com/articles/alphabet-spacex-spur-record-u-s-equity-sales,the information,综合科技,科技金融,2026-07-20T15:52:37+00:00
Exclusive: Oracle Data Centers Face Multibillion-Dollar Cost Surprises,2026-07-19,Subscribe to unlock,https://www.theinformation.com/newsletters/ai-infrastructure/exclusive-oracle-data-centers-face-multibillion-dollar-cost-surprises,the information,综合科技,科技金融,2026-07-20T15:52:39+00:00
