title,published_at,content,url,source_name,domain,sub_domain,crawled_at
Scientists Uncover Cause of Inflammatory Bowel Disease Solving Decades-Old Mystery,2026-06-20,"Scientists identified an autoimmune mechanism linked to a major IBD risk gene, opening the door to targeted diagnosis and personalized therapies for thousands of patients.
For decades, inflammatory bowel disease (IBD) has been treated as a single disorder, even though patients often experience dramatically different symptoms, disease courses, and responses to therapy. A new study suggests there may be a good reason for that: what doctors call IBD could actually be a collection of distinct diseases driven by different biological mechanisms.
Researchers from the
University of Oxford
’s Nuffield Department of Medicine, Newcastle University’s Translational and Clinical Research Institute, and the Department of Immunology at Cambridge University Hospitals NHS Foundation Trust have identified a key driver of disease in a subset of patients. Their findings, published in the
New England Journal of Medicine
, reveal an immune malfunction that not only triggers uncontrolled inflammation but also helps explain one of the strongest genetic risk factors linked to IBD.
The team analyzed more than 4,900 people with Crohn’s disease and ulcerative colitis, the two main forms of IBD. They discovered that some patients develop autoimmune responses against interleukin-10 (IL-10), a crucial molecule that normally acts as one of the body’s primary brakes on inflammation. They also found that this immune attack is closely tied to a genetic variant long associated with severe IBD.
Under normal circumstances, IL-10 helps prevent the immune system from overreacting and damaging healthy tissue. But when antibodies block IL-10, this protective mechanism is disabled, allowing inflammation to persist unchecked and potentially fueling disease.
IBD includes Crohn’s disease and ulcerative colitis and affects about 500,000 people in the UK and millions more worldwide. The lifelong condition often begins during adolescence or early adulthood and may require repeated hospitalizations, long-term immunosuppressive treatments, and sometimes surgery.
Although treatment options have improved, many patients move from one therapy to another without achieving long-term disease control. This can significantly affect quality of life while also placing a substantial financial burden on health care systems.
The researchers found elevated levels of anti-IL10 neutralizing autoantibodies in the blood of about 3.5% of patients with Crohn’s disease or ulcerative colitis, while these antibodies were absent in healthy individuals. Based on current estimates, this could mean that 15,000 to 20,000 people with IBD in the UK carry these autoantibodies.
The team also discovered a strong association between these antibodies and a genetic variant known as HLA-DRB1*01:03.
Oxford researchers first linked HLA-DRB1*01:03 to a severe form of IBD three decades ago. The new study reveals that people who carry this variant are much more likely to produce antibodies that block IL-10, providing a possible explanation for how the gene increases disease risk.
Professor Holm Uhlig, a pediatric gastroenterologist and Director of the Centre for Human Genetics at the University of Oxford’s Nuffield Department of Medicine and a senior author of the study, said:
“We’ve suspected an important role of interleukin 10 in patients with inflammatory bowel disease for decades. The study now provides clear evidence and contributes the missing link between a well-known genetic variant that had been linked to severe inflammatory bowel disease in the past and the very recently discovered autoimmunity to interleukin 10.”
“Understanding what drives the inflammation provides a clear explanation for disease in this group of people and opens the door to new treatments that target the autoantibodies themselves or cells that produce those autoantibodies.”
Sophie Hambleton, Professor of Pediatrics and Immunology at Newcastle University, said, “This discovery shows how the study of rare, inherited disorders can shed new light on common conditions. The groundwork was laid over 10 years ago when genetic defects in IL-10 or its receptor were found in young children with severe IBD. Later, we realized that neutralizing autoantibodies against IL-10 was mimicking this effect in 2 little girls with colitis.”
The researchers believe the findings could support the development of a blood test that identifies this specific patient subgroup, helping doctors select more appropriate treatments sooner.
Dr. Rainer Doffinger, clinical immunologist at the Cambridge University Hospitals NHS Foundation Trust, said, “By identifying patients early and giving them targeted treatment, we could reduce reliance on expensive ongoing therapy and prevent complications. Even modest reductions in biologic treatment, admissions, and surgery could translate into savings of many millions of pounds annually for the NHS, alongside the major benefits for patients through fewer interventions, improved quality of life, or even durable remission.”
Professor Simon Travis, Professor of Clinical Gastroenterology at the University of Oxford and Kennedy Institute of Rheumatology, said, “This is the most exciting discovery in a lifetime specializing in IBD. It means that we can now identify a group where we know what is causing the disease, and that creates a real opportunity to change how we manage this disease.”
The findings mark an important step toward more personalized approaches to diagnosing and treating IBD. Instead of relying solely on symptoms, future treatment strategies could be guided by the specific biological mechanisms driving an individual patient’s disease.
Reference: “Interleukin-10 Autoantibodies and HLA-DRB1*01:03 in Inflammatory Bowel Disease” by Nima Gharahdaghi, Pai-Jui Yeh, Lourdes Ceron-Gutierrez, Helen Griffin, Hannah Gordon, Chamara Jayamanne, Alice Fracchia, Amanda Y. Chong, Alissa Walsh, Oliver Brain, Katherine Baker, Hannah Kockelbergh, Yang Luo, Martha Guevara Becerra, Katherine Vadakethala, Madeleine Coy, Ladan Kabiri, Martin Barnardo, Susanna Dunachie, Barbara Kronsteiner, Anna Adams, Darren Fowler, Qian Zhang, Laura Fachal, Carl A. Anderson, Rofaida Desoki, Marie Vibeke Vestergaard, Lone Larsen, Nicola J. Wyatt, Robert D. Lees, Robert J. Mulligan, Chaonan Dong, Mohmmed Tauseef Sharip, Siân E. Faustini, Adrian Shields, Julia Pakpoor, Bushra Naz, Alex Richter, Jack Satsangi, Christopher A. Lamb, Miles Parkes, Fiona Powrie, Alexander J. Mentzer, Aleksejs Sazonovs, Tine Jess, Paul Klenerman, Simon Travis, Sophie Hambleton, Rainer Doffinger and Holm H. Uhlig, 10 June 2026,
New England Journal of Medicine
DOI: 10.1056/NEJMoa2513654
The research was supported by the National Institute for Health and Care Research (NIHR) Biomedical Research Centre’s in Oxford, Cambridge and Newcastle.
Never miss a breakthrough:
Join the SciTechDaily newsletter.
Follow us on
Gastroenterology
Immune System
Inflammation
University of Oxford
Scientists Flip Immune System “Switch,” Uncover Surprising Path To Stop Gut Inflammation
Aging Immune Cells May Rewrite Their Own DNA To Stay Inflammatory
Scientists Warn: Just 1 Day of Sleep Deprivation Can Disrupt Your Immune System
Milk May Exacerbate MS Symptoms – Cow’s Milk Protein Triggers Autoimmune Response
New Research Finds Potential Mechanism Linking Autism and Intestinal Inflammation
Oral Vaccines Sometimes Fail in Resource-Poor Countries – New Research Helps Explain Why
Eating a Western Diet Impairs the Immune System in the Gut – May Increase Risk of Inflammation, Infection
Herpes Simplex Virus Can Infect the Brain by Evading the Immune Response
Scientists Reveal Cellular Changes That Lead to Chronic Allergic Inflammation",https://scitechdaily.com/scientists-uncover-cause-of-inflammatory-bowel-disease-solving-decades-old-mystery/,scitechdaily,综合科技,无,2026-06-21T15:52:02+00:00
The Surprising Reason Swimming Could Be Better for Your Heart Than Running,2026-06-20,"Swimming matched running for fitness gains but delivered greater heart growth and more favorable molecular changes, making it potentially more beneficial for cardiovascular health.
For decades, swimming and running have been considered two of the best forms of aerobic exercise for cardiovascular health.
But new research suggests they may not strengthen the heart in exactly the same way. In a study using an animal model, scientists in Brazil found that swimming produced more extensive changes in heart structure and function than running, pointing to distinct biological pathways through which different forms of exercise shape cardiovascular health.
Researchers at the Federal University of São Paulo (UNIFESP) discovered that swimming was more effective at promoting healthy heart growth and increasing the force with which the heart muscle (myocardium) contracts.
“Swimming and running are two excellent ways to improve cardiorespiratory health and protect the heart muscle, but we wanted to know if one could be even more beneficial than the other. We found that, although both increase respiratory capacity, swimming goes a step further by combining functional and molecular adaptations that make the heart stronger and more efficient,” says Andrey Jorge Serra, a professor at UNIFESP and coordinator of the study supported by FAPESP.
The findings, published in
Scientific Reports
, showed that swimming triggers stronger changes in microRNAs involved in key heart adaptations. These include heart cell growth, the development of new blood vessels (angiogenesis), protection against cell death, regulation of contractile function, and responses to oxidative stress. The effects were more pronounced than those observed with running.
MicroRNAs are molecules that regulate the expression of messenger RNAs, which are responsible for protein synthesis.
“Although several studies had already examined the expression of microRNAs regulated by aerobic training in general, little was known about expression patterns when swimming and running were compared in the same experimental setting. Therefore, this study reveals that there’s a distinction in cardiovascular effects between these two modalities,” says Serra.
For the experiment, mice followed an eight-week training program that included 60-minute exercise sessions five days per week. The animals were divided into three groups: a sedentary group, a running group, and a swimming group. Because swimming and running are fundamentally different activities, researchers compared them based on relative exercise intensity rather than speed. Intensity was measured using maximum oxygen consumption (VO₂ max), a standard indicator of the body’s ability to capture, transport, and use oxygen during physical activity.
Both forms of exercise improved fitness to a similar degree. VO₂ max increased by more than 5% between the beginning and end of the training period in both exercise groups. However, only swimming produced significant structural changes in the heart, including increases in overall heart mass and left ventricular mass. Running did not result in meaningful differences compared with sedentary animals.
“People’s choice of sport depends largely on personal preference, aptitude, and enjoyment. But our results show that swimming may have a special impact in situations involving myocardial recovery, cardiac rehabilitation, and above all, scientific research. This is also relevant because studies on aerobic exercise often use running and swimming interchangeably, and we now know that the effects aren’t the same,” Serra explains.
Researchers conducted a range of tests before and after the training program to assess cardiorespiratory capacity, physical fitness, and the structure and function of the heart and myocardium.
The team also examined gene expression and protein signaling pathways linked to physiological cardiac hypertrophy, a healthy form of heart enlargement caused by exercise. In addition, they investigated the molecular mechanisms used to identify regulatory microRNAs.
“Although we don’t yet know why this change occurs at the molecular level, of the microRNA, we were able to delve deeply into and investigate the molecular pathways that control physiological hypertrophy,” the researcher adds.
Reference: “Swimming is superior to running in inducing physiological cardiac hypertrophy and enhancing myocardial performance” by Amanda Yoshizaki, Ednei Luiz Antonio, Luis Dos Santos, Mariana Teixeira dos Santos, Flavia Leticia Martins, Regiane Santos Feliciano, Jose Antonio Silva Junior, Brunno Lemes de Melo, Danilo Sales Bocalini, Paulo José Ferreira Tucci, Adriana Castello Costa Girardi and Andrey Jorge Serra, 29 January 2026,
Scientific Reports
DOI: 10.1038/s41598-026-36818-2
Never miss a breakthrough:
Join the SciTechDaily newsletter.
Follow us on
Public Health
São Paulo Research Foundation
Scientists Say Most Adults Need 4 Times More Exercise Than Recommended for Major Heart Benefits
Study: Just One Extra Hour of Exercise Each Week Can Reduce Your Risk for Common Heart Condition
How Many Hours of Sitting Is Too Much for Your Heart?
New Drug Makes Exercise Easier for People With Common Heart Condition
Climbing Just 50 Steps a Day Can Cut Your Risk of Heart Disease by 20%
Walking Is Good, but Moderate-Vigorous Exercise Boosts Fitness 3x More
COVID-19’s Impact on the Heart – An In-Depth Look
More Is Not Always Better With Exercise – Here’s What’s Best for Heart Health
Physical Activity Is Not Always Good for the Heart – Here’s What You Need to Know",https://scitechdaily.com/the-surprising-reason-swimming-could-be-better-for-your-heart-than-running/,scitechdaily,综合科技,无,2026-06-21T15:52:04+00:00
Could Vitamin C Be the Secret to Keeping Your Brain Younger?,2026-06-20,"Lower vitamin C levels were linked to reduced brain volume and weaker neural connectivity in older adults, suggesting a potential connection between nutrition and brain health.
Could a common vitamin help preserve the brain as we age?
A new study of more than 2,000 older adults in Japan found that people with lower levels of vitamin C in their blood tended to have less gray matter and weaker connectivity within a key brain network linked to memory and attention. The findings, published in
Vitamin C is best known for supporting immune function, but it also acts as a powerful antioxidant and plays important roles in protecting nerve cells from oxidative stress. Previous studies have suggested that diets rich in vitamin C are associated with a lower risk of cognitive impairment in older adults. However, few studies have directly examined whether vitamin C levels circulating in the blood are related to measurable differences in brain structure and communication between brain regions.
To investigate, the researchers analyzed magnetic resonance imaging (MRI) scans and blood
samples from 2,044 Japanese adults aged 64 and older. They measured the volume of gray and white matter throughout the brain while accounting for differences in overall brain size.
The team also examined connectivity within the default mode network, a collection of interconnected brain regions that remains active during internally focused thought and is involved in functions such as memory, self-reflection, and attention.
After adjusting for factors that can influence brain health, including age, physical activity, and education level, the researchers found that participants with lower plasma vitamin C levels generally had less gray matter and weaker connectivity within the default mode network.
The results raise the possibility that maintaining healthy vitamin C levels could help support cognitive function and reduce age-related cognitive decline. However, the study does not establish a cause-and-effect relationship between vitamin C and brain health. Additional research will be needed to clarify the biological processes behind these associations.
The researchers also suggest future studies should track vitamin C levels over longer periods, consider a broader range of lifestyle and dietary factors, and include participants from more diverse ethnic and socioeconomic backgrounds.
Tomohiro Shintaku adds, “Our study demonstrates that higher plasma vitamin C levels are associated with better preserved structural connectivity of the default mode network (DMN), a key brain network involved in cognitive function. This finding generates the exciting hypothesis that a diet rich in vitamin C might play a supportive role in maintaining brain health and mitigating age-related cognitive decline in older adults.”
“What I found most fascinating about this research is that we were able to detect these subtle but significant associations between a single nutritional factor and large-scale brain networks by utilizing a robust, community-based cohort of over 2,000 older adults. It truly highlights the potential impact of our everyday dietary habits on our brain structures.”
Reference: “Plasma vitamin C levels are associated with brain structural networks on MRI: A large cohort study” by Haruka Nagaya, Keita Watanabe, Tomohiro Shintaku, Miho Sasaki, Jusei Kudo, Sera Kasai, Yuka Ishimoto, Kana Saito, Shuichi Matsuhashi, Taiki Koshiishi, Mizuki Imura, Amo Ozawa, Saaya Mori, Daisuke Watanabe, Shin Shukunobe, Tatsuro Sasaki, Soichiro Tatsuo, Shinya Kakehata, Tatsuya Mikami, Daichi Kokubu, Yusuke Ushida and Shingo Kakeda, 10 June 2026,
DOI: 10.1371/journal.pone.0348504
The funder (KAGOME CO., LTD.) provided support in the form of salaries for authors D.K. and Y.U., but did not have any additional role in the study design, data collection and analysis, decision to publish, or preparation of the manuscript. Additionally, this research was supported by the Japan Agency for Medical Research and Development (AMED) under Grant Numbers JP16dk0207025 and JP21dk0207053.
Never miss a breakthrough:
Join the SciTechDaily newsletter.
Follow us on
25-Year Study Unveils Secrets to Lifelong Cognitive Performance
Turning Back Time: Study Links Key Nutrients to Slower Brain Aging
New Research: Talking Faster Is Linked to Better Brain Health As We Age
Defending Against Memory Loss: Prior Training Shows “Profound Benefits” in Cognitive Aging
Stanford Scientists Identify Gene “Fingerprint” for Brain Aging
An Early Warning: How Your Walking Habits Could Predict Your Brain Health
How Music Can Keep the Brain Young
Walking Can Improve Cognitive Function
Diabetes Shown To Accelerate Brain Aging and Cognitive Decline by 26%",https://scitechdaily.com/could-vitamin-c-be-the-secret-to-keeping-your-brain-younger/,scitechdaily,综合科技,无,2026-06-21T15:52:06+00:00
The Surprising Fix for Robot Traffic Jams,2026-06-20,"Harvard researchers found that adding a little randomness to robot movements can prevent gridlock and dramatically boost efficiency in crowded swarms.
Imagine a swarm of robots sent into a tight space to handle an urgent job, such as cleaning up an oil spill or assembling complex equipment. At first, adding more robots speeds things up. But beyond a certain point, the space becomes crowded, robots interfere with one another, and progress slows to a crawl.
This raises a deceptively simple question: in a limited area, how many robots are actually optimal? Researchers at Harvard believe they have found a compelling answer.
A team led by L. Mahadevan, the Lola England de Valpine Professor of Applied Mathematics, Organismic and Evolutionary Biology, and Physics, explored this problem using a mix of mathematical modeling, computer simulations, and real-world experiments. Their findings show that in crowded conditions, introducing a controlled amount of randomness, referred to as “noise,” into how robots move can reduce congestion and significantly improve efficiency.
The work, published in
Proceedings of the National Academy of Sciences
, was led by applied mathematics Ph.D. student Lucy Liu, who was co-advised by SEAS Senior Research Fellow Justin Werfel. The results highlight how simple, local movement rules can give rise to complex, coordinated behavior. These insights could shape the design of robot swarms and inform how we manage crowded human environments.
Analyzing dense crowds mathematically is extremely challenging because of the enormous number of possible interactions, Liu explained. To simplify the problem, the researchers treated each robot as a basic agent that moves with a tunable amount of “wiggle” in its path.
“This might be counterintuitive, because how could randomness make things easier to work with?” said Liu. “But in this case, when you have a lot of randomness, it becomes possible to take averages – average distances, average times, average behaviors. This makes it a lot easier to make predictions.”
To test their ideas, the team created computer simulations in which large numbers of agents started at random positions and were assigned random destinations. Once an agent reached its goal, it was immediately given a new one, mimicking continuous task assignment in real-world operations.
Each agent moved toward its goal with a controllable level of randomness. With no noise, agents traveled in perfectly straight lines. With high noise, they wandered in erratic zigzags. While zigzagging might seem inefficient, it allowed agents to maneuver around one another more easily.
The simulations revealed a clear pattern. When agents followed straight paths, they quickly formed dense traffic jams where movement stalled. When randomness was too high, congestion disappeared, but efficiency dropped because agents wandered too much. The best performance came from a middle ground, a “Goldilocks” level of noise where agents briefly interacted but could still slip past each other and keep moving.
Using these observations, the researchers developed mathematical formulas to estimate “goal attainment rate,” which measures how many tasks are completed over time. These formulas made it possible to calculate the optimal combination of crowd density and movement randomness to maximize efficiency.
To see if their findings held up outside simulations, Liu worked with physicist Federico Toschi at Eindhoven University of Technology in the Netherlands. Together, they tested swarms of small wheeled robots in a lab equipped with an overhead camera system.
Each robot was marked with a QR code so its position could be tracked and updated in real time. Although the robots moved more slowly and less precisely than their simulated counterparts, the same patterns emerged. A moderate amount of randomness helped prevent gridlock and kept tasks progressing.
The study reinforces an important idea. Complex coordination does not always require sophisticated central control or highly intelligent machines. Instead, simple local rules can be enough to produce efficient group behavior, at least within certain density limits.
“Understanding how active matter, whether it is a swarm of ants, a herd of animals, or a group of robots, become functional and execute tasks in crowded environments using the principles of self-organization, is relevant to many questions in behavioral ecology,” Mahadevan said. “Our study suggests strategies that might well be much broader than the instantiation we have focused on.”
Liu noted that she has long been interested in designing safer and more efficient crowded environments. This research points toward a future where the movement of crowds, whether made up of people, robots, vehicles, or a combination, can be predicted and optimized using mathematical principles.
In other words, the solution to overcrowding may not be stricter control, but a carefully tuned amount of flexibility.
Reference: “Noise-enabled goal attainment in crowded collectives” by Lucy Liu, Justin Werfel, Federico Toschi and L. Mahadevan, 13 February 2026,
Proceedings of the National Academy of Sciences
DOI: 10.1073/pnas.2519032123
Funding for the research came from the National Science Foundation Graduate Research Fellowship Program under Grant No. DGE 2140743, along with grants from the Simons Foundation and the Henri Seydoux Fund.
Never miss a breakthrough:
Join the SciTechDaily newsletter.
Follow us on
Artificial Intelligence
Evolutionary Biology
Harvard University
HuGE AI Breakthrough: Using Crowdsourced Feedback in Robot Training
“Cheetah-Cub Robot” Runs Like a Cat
Robotic RoboBees Achieve First Controlled Flight
Combustible Gases Enable Soft Robots to Jump
Cancer-Fighting DNA Nanorobots Could Target Specific Cells for Repair
Robotic Tentacles Have a Soft Enough Touch to Pick Up Flowers
DARPA & Harvard’s Soft, Self-Camouflaging Robot
Algorithm Enables Robots to Learn and Adapt to Help Complete Tasks
Educational Touch-Screen Games Prove Effective",https://scitechdaily.com/the-surprising-fix-for-robot-traffic-jams/,scitechdaily,综合科技,无,2026-06-21T15:52:08+00:00
"AI Devices, Midjourney’s Spas and Snap’s Flop-sicles",2026-06-20,Subscribe to unlock,https://www.theinformation.com/newsletters/the-weekend/ai-devices-midjourneys-spas-snaps-flop-sicles,the information,综合科技,科技金融,2026-06-21T15:55:04+00:00
The Law Professor Behind Bernie’s AI Sovereign Wealth Fund Idea,2026-06-20,Subscribe to unlock,https://www.theinformation.com/articles/law-professor-behind-bernies-ai-sovereign-wealth-fund-idea,the information,综合科技,科技金融,2026-06-21T15:55:06+00:00
The Chainsmokers’ VC Firm Mantis Raising $100 Million Fund,2026-06-20,Subscribe to unlock,https://www.theinformation.com/newsletters/dealmaker/chainsmokers-vc-firm-mantis-raising-100-million-fund,the information,综合科技,科技金融,2026-06-21T15:55:08+00:00
