title,published_at,content,url,source_name,domain,sub_domain,crawled_at
World’s First Superconducting Quantum Heat Engine Could Transform Quantum Computing,2026-07-19,"A machine smaller than a grain of sand has turned heat into useful work near
absolute zero
, opening a new path to far more powerful quantum computers.
Researchers at
Aalto University
have built the first cyclic quantum heat engine inside a superconducting circuit. The device uses a qubit, the basic unit of quantum information, as its working substance and repeatedly drives it through heating, cooling, and energy conversion.
The study, led by Academy Professor Mikko Möttönen, was published in
Nature Communications
The result brings a familiar technology into an unfamiliar world. Conventional heat engines power vehicles and electricity plants by moving energy between hot and cold environments. The Aalto device follows the same basic principle, but it operates on a microscopic scale where quantum mechanics determines how energy behaves.
At the center of the engine is a flux-tunable transmon qubit connected to a resonator and a quantum circuit refrigerator. Transmons are widely used in superconducting quantum computers because they can store and process quantum information while being controlled with microwave signals.
The refrigerator played two opposing roles. Instead of requiring separate hot and cold reservoirs, the researchers adjusted a single device to either heat or cool the qubit. They then changed the qubit’s energy level at carefully chosen moments, completing the four stages of a quantum Otto cycle.
The Otto cycle is best known as the thermodynamic process behind many gasoline engines. In this experiment, however, its working substance was not compressed gas inside a cylinder. It was a qubit exchanging extremely small amounts of energy inside a cryogenic circuit.
“In our experiment, we built a nanofabricated heat engine using superconducting circuits and operated it in a cryostat near absolute zero. At its heart is a transmon qubit, one of the basic building blocks of modern quantum technologies,” says Tuomas Uusnäkki, the study’s first author.
The team began with the qubit in a thermal state and ran the engine for as many as three consecutive cycles. Single-shot measurements allowed the researchers to track changes in the qubit’s state and calculate how much heat it absorbed, how much work it produced, and how efficiently it operated.
“Our quantum-circuit refrigerator can be tuned to both heat and cool the qubit on demand. Using carefully timed control pulses, we drove the engine in an Otto cycle and monitored the qubit state as the engine ran,” explains Uusnäkki.
The measurements showed that the engine produced positive work rather than merely shifting heat around the circuit. Its observed power and efficiency also agreed with the researchers’ simulations, providing evidence that the device behaved as a genuine cyclic heat engine.
“This is the first experimental demonstration of a cyclic quantum heat engine in superconducting circuits. Using a single controllable quantum refrigerator as both the hot and cold environment of the engine makes it simpler and more versatile,” says Uusnäkki.
Quantum heat engines have previously been demonstrated with systems including trapped ions, atomic gases, nuclear spins, and defects in diamonds. Superconducting circuits are especially important because they are already among the leading platforms for
quantum computing
, communication, and sensing. Until now, however, no experiment had completed a cyclic quantum heat engine using this technology.
The immediate significance is not the amount of work generated, which is extraordinarily small. Instead, the experiment shows that heat can be deliberately controlled and converted inside the same type of circuitry used to build quantum processors.
That capability may become valuable as quantum computers grow. Today’s superconducting machines depend on large numbers of microwave cables running between room-temperature electronics and processors kept at temperatures only a fraction of a degree above absolute zero. Each cable adds cost, occupies space, and can carry unwanted heat or noise into the system.
The researchers are now working toward a fully autonomous version of the engine. One possible application would be reading the state of a qubit without sending a microwave signal from the cold processor to room temperature. Placing more control functions directly inside the cryogenic circuit could reduce the amount of external wiring required.
“Finland’s Quantum Technology Strategy envisions a quantum computer with one thousand logical qubits by 2035, which probably means hundreds of thousands of physical qubits. Doing that with current technology requires millions of microwave cables costing thousands of euros each. The cables also introduce noise into the system. Using autonomous devices instead would mostly eliminate the need for those cables,” Möttönen says.
Reference: “Initial demonstration of a quantum heat engine based on dissipation-engineered superconducting circuits” by Tuomas Uusnäkki, Timm Mörstedt, Wallace Teixeira, Miika Rasola and Mikko Möttönen, 5 May 2026,
Nature Communications
DOI: 10.1038/s41467-026-72651-x
The researchers used the facilities of
, Finland’s national research infrastructure for nano-, micro-, and quantum technology in their pioneering study. The work was funded by the Research Council of Finland and the Finnish Cultural Foundation.
Never miss a breakthrough:
Join the SciTechDaily newsletter.
Follow us on
Aalto University
Quantum Computing
Quantum Technology
Superconduction
Physicists Break Quantum Barrier With Record-Breaking Qubit Coherence
New Simple Device Uses Sound Waves to Store Quantum Information
Engineers Develop a Radical New Architecture for Quantum Computing
Yale Researchers Cross the “Break Even” Point in Preserving a Bit of Quantum Information
Researchers Develop A Universal Quantum Gate
Researchers Develop a New Quantum Error Correcting Code
Physicists Track Quantum Errors in Real Time
Physicists Create and Control a Large Quantum Mechanical System Built on Photons
Quantum Bits Store Data for Nearly Two Seconds Using Laboratory Grown Diamonds",https://scitechdaily.com/worlds-first-superconducting-quantum-heat-engine-could-transform-quantum-computing/,scitechdaily,综合科技,无,2026-07-20T15:49:35+00:00
Scientists Turned a 200-Year-Old Light Trick Into a Modern Breakthrough,2026-07-19,"A classic 200-year-old light experiment has given scientists a simple new way to create exotic light structures that could help shape the future of computing and photonics.
Scientists at Nanyang Technological University, Singapore (NTU Singapore) have found a far simpler way to create unusual and stable light structures known as “optical skyrmions.”
These tiny formations involve swirling patterns in the properties of light. Their structure has been compared to the outward-pointing spikes of a hedgehog.
Rather than using expensive and highly engineered materials, the researchers produced the skyrmions by directing a laser at a small circular disc. The setup relies on a classic optical effect called the “Poisson spot.”
The approach could make it much easier for scientists to create, examine, and modify optical skyrmions.
Skyrmions have become an important area of research because of their potential to carry and store information. In the future, they could contribute to new data storage, communication, and computing technologies.
The findings were published in the scientific journal
. The research was led by Nanyang Assistant Professor Shen Yijie from NTU’s School of Physical and Mathematical Sciences and School of Electrical and Electronic Engineering.
“What is remarkable is that optical skyrmions can now be generated using a simple effect where light bends around an object, without relying on expensive, complex man-made
metamaterials
or highly specialized techniques,” explained Asst Prof Shen.
“This could make optical skyrmions much more accessible to researchers. By lowering the technical barrier to creating and studying them, the method opens up new possibilities for scientists to study how they could be used in future optical, materials and computing research.”
A Poisson spot is a bright point that appears in the center of the shadow created by a circular object when it is illuminated by a coherent light source, such as a laser.
The effect played an important role in an early 19th-century debate about the nature of light. Scientists were trying to determine whether light traveled only in straight lines as particles or could also bend and spread like a wave.
Wave theory predicted that a bright point should appear in the middle of the disc’s shadow, even though that area would normally be expected to remain dark. The appearance of the Poisson spot became a landmark demonstration of diffraction and the wave-like behavior of light.
Light diffraction occurs when light bends and spreads as it passes around an object or moves through a small opening.
The researchers discovered that their Poisson spot system could generate as many as four related topological field patterns at the same time.
These were spin skyrmions, Stokes skyrmions, electric-field skyrmions, and magnetic-field skyrmions. Spin refers to rotation-like characteristics of light, while Stokes parameters describe polarization, meaning the direction in which light waves vibrate as they move.
This “four-in-one” behavior could give researchers a new way to compare how different optical skyrmions form, change, and interact within a single light field.
In computer simulations, the structures appeared as swirling arrangements of arrows. These arrows illustrated how different properties of light changed direction across the Poisson spot.
Scientists can manipulate many features of light, including its intensity, phase, polarization, spin, and electric and magnetic field vectors.
Each of these properties can produce different topological structures. Such patterns can remain stable even when they are stretched or distorted.
Asst Prof Shen said: “In the light spot that we created, several types of optical vectors could form topological structures at the same time. These different components of light are closely connected, but they do not necessarily form identical topological patterns.
“Being able to produce and compare several skyrmions within one system could help researchers uncover new links between light’s electric, magnetic and other physical properties.”
Skyrmions were first proposed in particle and nuclear physics. They were later investigated in condensed matter physics and magnetic materials before becoming a growing focus in photonics, where they appear as stable, particle-like patterns within light fields.
Earlier studies typically created optical skyrmions using metamaterials. These are artificially engineered micro-sized structures that manipulate light in ways ordinary materials cannot.
The new findings provide a foundation for further research into topological light. Over time, the work could contribute to advances in photonics, advanced materials, information processing, and computing.
Reference: “Optical skyrmions in Poisson spots” by Jun Yao, Xi Xie, Yuan Meng, Sheng Sun, Jun Hu, Yijie Shen and Yuanjie Yang, 19 June 2026,
DOI: 10.1364/OPTICA.591840
Never miss a breakthrough:
Join the SciTechDaily newsletter.
Follow us on
Electromagnetics
Nanyang Technological University
Particle Physics
Nearly the Speed of Light in One Millimeter: Presenting a New Type of Particle Accelerator
Particle Accelerator Physics: Experiment Reveals New Options for Synchrotron Light Sources
New Photonics Breakthrough Could Lead to Unprecedented Internet Data Speeds
Scientists Invent Way to See Fastest Motions of Electrons That Drive Chemistry for the First Time
Unprecedented Insight Into the Birth of Photoelectrons and Fundamental Nature of Light-Matter Interactions
Efficient Quantum-Mechanical Interface Leads to a Strong Interaction Between Light and Matter
Researchers Use Light to Control High-Speed Chemical Reactions in a New Way
Physicists Develop a New Method to Accelerate Charged Particles
Fastest Laser Blast – 67 Quintillionths of a Second",https://scitechdaily.com/scientists-turned-a-200-year-old-light-trick-into-a-modern-breakthrough/,scitechdaily,综合科技,无,2026-07-20T15:49:37+00:00
Physicists Just Turned a Black Hole Energy Theory Into Reality,2026-07-19,"Scientists have recreated a famous
phenomenon in the lab using synthetic rotation, bringing a 50-year-old theory closer to real-world technology.
More than 50 years ago, physicist Sir Roger Penrose proposed a remarkable way that energy might be taken from a rapidly spinning black hole. In his theoretical scenario, a particle would enter the black hole’s ergosphere, a region where the rotation of the black hole drags the surrounding fabric of space along with it. The particle could then split into two pieces. One would plunge into the black hole, while the other would escape with more energy than the original particle carried.
Physicist Yakov Zel’dovich later extended this general idea to waves. He predicted that when a wave interacts with an object rotating fast enough, the wave could draw energy from that rotation and emerge stronger than before.
Researchers at the Advanced Science Research Center at the CUNY Graduate Center (CUNY ASRC) have now demonstrated a new method for producing this type of wave amplification. Their results were published in
Instead of physically spinning an object at extreme speed, the researchers developed a radio frequency device whose properties change across space and time in a way that imitates rotation. This engineered system produces synthetic ultrafast rotation, allowing scientists to simulate rotational speeds far beyond the limits of mechanical machinery.
The approach helps overcome a major obstacle that has long prevented researchers from experimentally investigating the behavior of waves interacting with extremely fast rotation.
“Our approach facilitates a new method of wave–matter interaction in which waves with selected rotational properties extract energy from synthetic time-engineered rotation, producing a form of broadband selective amplification,” said principal investigator Andrea Alù, Distinguished Professor and Einstein Professor of Physics at the CUNY Graduate Center and founding director of the CUNY ASRC’s Photonics Initiative.
“This successful experiment moves ideas about extreme rotational dynamics from theory to practice and creates a versatile experimental platform for exploring a broad range of phenomena at the intersection of astrophysics, wave physics, and quantum science,” said lead author Hadiseh Nasari, a postdoctoral researcher with the CUNY ASRC’s Photonics Initiative. “The work has implications for advances in fundamental science and in communications, optics and photonics.”
The researchers focused on a central question. Could electromagnetic waves sent into a stationary device behave as though they were interacting with something rotating at an ultrafast speed? More importantly, could those waves extract energy from that synthetic motion?
To test the concept, the team constructed a ring-shaped network of electronic resonators. The properties of the resonators were changed rapidly in a precisely timed sequence, creating a pattern that traveled around the ring.
Nothing in the device physically rotated. However, the traveling pattern caused the electromagnetic waves to experience the system as though it were spinning at an enormous speed.
“Waves with the appropriate rotational characteristics extracted energy from the system and became amplified, reproducing the essential physics of the Penrose–Zel’dovich process,” said co-lead author Hady Moussa, a former PhD student with the CUNY ASRC Photonics Initiative. “Our approach relies on engineered
metamaterials
that are designed to control how waves propagate.”
Metamaterials are specially designed structures that can guide and manipulate waves in ways that ordinary materials cannot. In this experiment, they allowed the researchers to reproduce the essential behavior predicted by Penrose and Zel’dovich without requiring an actual black hole or a mechanically spinning object.
Synthetic rotation can imitate apparent motion faster than the speed of light without requiring matter or information to physically travel at that speed. This gives scientists a controlled way to explore extreme regimes that would otherwise be difficult or impossible to reproduce in a laboratory.
The achievement creates a new experimental platform for investigating phenomena connected to astrophysics, wave behavior, and quantum science. It could also lead to potential applications in wireless communications, classical optics, and quantum optics.
Future research will need to determine how the findings can be incorporated into practical technologies. The same principles could also be extended to photonic and quantum systems, potentially creating new methods for controlling light, processing information, and studying wave phenomena inspired by some of the universe’s most extreme environments.
Reference: “Observation of Floquet rotational super-radiance” by Hadiseh Nasari, Hady Moussa, Yoshiaki Kasahara, Arno Thielens and Andrea Alù, 8 July 2026,
DOI: 10.1038/s41586-026-10725-y
The research was supported by the U.S. Department of Defense, the U.S. National Science Foundation, and the Simons Foundation.
Never miss a breakthrough:
Join the SciTechDaily newsletter.
Follow us on
Astrophysics
City University of New York
New Equations Go Beyond Einstein’s Theory of General Relativity
These Unusual Black Holes Offer an Infinite Number of Possible Futures
Hands-On Tests at Sandia’s Z Machine Contradict Black Hole Models
Researchers Simulate the Conditions Around Black Holes Using a Specially Designed Water Bath
“Black-Hole-Scope” Provides Insight into Space Directly Surrounding a Supermassive Black Hole
A Pulsar Orbiting a Black Hole Could be the ‘Holy Grail’ for Testing Gravity
Theoretical Physicists Reveal the Turbulent Nature of Black Holes
Study Takes Singularity Out of Black Holes
Black Holes Have Properties That Resemble the Dynamics of Solids and Liquids",https://scitechdaily.com/physicists-just-turned-a-black-hole-energy-theory-into-reality/,scitechdaily,综合科技,无,2026-07-20T15:49:39+00:00
NASA Reveals the Black Sea’s Stunning Annual Turquoise Transformation,2026-07-19,"NASA captured the Black Sea’s annual turquoise transformation as massive blooms of microscopic plankton turned the water into a dazzling spectacle visible from orbit.
The Black Sea lies between Europe and Asia and reaches the Mediterranean Sea through a series of connected waterways. Although its waters are often dark, the sea can undergo a dramatic color change during spring and summer, when broad swirls of turquoise spread across its surface.
NASA’s PACE (Plankton, Aerosol, Cloud, ocean Ecosystem) satellite observed this seasonal transformation on June 22, 2026. Its OCI (Ocean Color Instrument) captured the image above, revealing bright blue and turquoise patterns stretching across the Black Sea.
The striking color was likely produced by coccolithophores, microscopic phytoplankton coated in small plates of calcium carbonate. When these organisms gather in enormous numbers, their reflective coverings can give the water a cloudy, milky blue appearance.
Coccolithophores are especially common in the Black Sea during late spring and early summer. At other points in the year, diatoms—a type of microscopic algae with silica shells—may become more abundant. Unlike coccolithophores, diatoms generally make the water appear darker rather than brighter.
The turquoise waters were also visible in the Bosphorus, the narrow channel that passes through Istanbul and links the Black Sea with the Sea of Marmara.
On May 27, 2026, roughly one month before the PACE satellite observation, an astronaut aboard the International Space Station photographed the colorful strait below. The image shows blooming phytoplankton following the movement of currents on both sides of the waterway. (Note that north is oriented toward the bottom of the frame.)
A single coccolithophore is far too small to see without magnification. During a major bloom, however, the organisms can multiply in such vast numbers that their collective presence becomes visible from orbit.
Satellite and astronaut observations allow scientists to follow how these blooms form, spread, and change over time. This type of remote sensing is particularly valuable in areas where researchers cannot easily collect samples directly from the water.
These blooms do more than create a spectacular view from space. Coccolithophores also participate in the ocean’s carbon cycle by absorbing carbon while they grow.
After the organisms die, some of that carbon can sink with their remains toward the seafloor. Once deposited there, it may stay out of the atmosphere for long periods of time.
NASA Earth Observatory image by Michala Garrison, using PACE data from NASA EOSDIS LANCE and GIBS/Worldview and the NASA Ocean Biology Distributed Active Archive Center OB.DAAC. Astronaut photograph ISS074-E-619520 was acquired on May 27, 2026, with a Nikon Z9 digital camera using a focal length of 50 millimeters. The photograph was supplied by the ISS Crew Earth Observations Facility and the Earth Science and Remote Sensing Unit at NASA Johnson Space Center.
A member of the Expedition 74 crew captured the image. It was cropped and adjusted to improve contrast, and lens artifacts were removed. Through the ISS National Lab, the International Space Station Program helps astronauts photograph parts of Earth that are especially valuable to researchers and the public. The program also makes those images freely available online.
Never miss a breakthrough:
Join the SciTechDaily newsletter.
Follow us on
NASA Earth Observatory
Phytoplankton
Frozen on Top, Blooming Below: Microscopic Life Awakens in Lake Erie
Green Menace: Toxic Algae and Environmental Neglect at California’s Clear Lake
Biological Brilliance: Filaments of Phytoplankton in Australia
Twists of Nature: Spectacular Swirls in the Sky and Sea Around Norway’s Remote Bear Island
Red Tide off Rio – “It Is Very Worrying”
Spied by Satellite: Phytoplankton Factory in the Argentine Sea
Sea Ice in Denmark Strait – Drifted More Than 1,000 Km (600 Miles) From the Arctic Ocean
Meandering Mississippi River: Photo Taken by Astronaut on Space Station Shows Divergence From State Boundaries
Incredible Rare Peek at Patagonia in Winter",https://scitechdaily.com/nasa-reveals-the-black-seas-stunning-annual-turquoise-transformation/,scitechdaily,综合科技,无,2026-07-20T15:49:40+00:00
